Relative,ʕærfæ kθir hæjo zæbætˤ bidiʃ,4
Relative,kθir hæjo zæbætˤ bidiʃ ʕæhæj,4
Relative,hæjo zæbætˤ bidiʃ ʕæhæj bidi,4
Relative,zæbætˤ bidiʃ ʕæhæj bidi ʕæhæ,4
Relative,ʃiklu min fustænhæ nædfi hek,4
Relative,meʃ næfshæ sˤaħ tˤajjib hæti,4
Relative,næfshæ sˤaħ tˤajjib hæti ɣirhæ,4
Relative,hæj læzim nɣæjrhæ tˤallaʕi hæd,4
Relative,læzim nɣæjrhæ tˤallaʕi hæd ħutˤihæ,4
Relative,nɣæjrhæ tˤallaʕi hæd ħutˤihæ hon,4
Relative,tˤallaʕi hæd ħutˤihæ hon bisˤir,4
Relative,hæd ħutˤihæ hon bisˤir zæjhæ,4
Relative,ħutˤihæ hon bisˤir zæjhæ sˤaħ,4
Relative,hon bisˤir zæjhæ sˤaħ læʔ,4
Relative,niʕmæl kæmæn wæħdæ bæs meʃ,4
Relative,kæmæn wæħdæ bæs meʃ kulhum,4
Relative,wæħdæ bæs meʃ kulhum ʔelhum,4
Relative,bæs meʃ kulhum ʔelhum næfs,4
Relative,meʃ kulhum ʔelhum næfs ʔel,4
Relative,kulhum ʔelhum næfs ʔel ʔiʃi,4
Relative,ʔelhum næfs ʔel ʔiʃi tˤalaʕi,4
Relative,næfs ʔel ʔiʃi tˤalaʕi hæd,4
Relative,ʔel ʔiʃi tˤalaʕi hæd ʔæzbatˤ,4
Relative,ʔiʃi tˤalaʕi hæd ʔæzbatˤ kæmæn,4
Relative,tˤalaʕi hæd ʔæzbatˤ kæmæn ʔilhæ,4
Relative,hæd ʔæzbatˤ kæmæn ʔilhæ ræbatˤa,4
Relative,ʔæzbatˤ kæmæn ʔilhæ ræbatˤa zærqæ,4
Relative,kæmæn ʔilhæ ræbatˤa zærqæ xudi,4
Relative,ʔilhæ ræbatˤa zærqæ xudi hæj,4
Relative,ræbatˤa zærqæ xudi hæj ʔeli,4
Relative,zærqæ xudi hæj ʔeli læbse,4
Relative,xudi hæj ʔeli læbse zærqæ,4
Relative,ʔærbutˤlik ʃæʕrek ʕæʃæn mæ jdˤal,4
Relative,ʃæʕrek ʕæʃæn mæ jdˤal jiʒi,4
Relative,ʕæʃæn mæ jdˤal jiʒi ʕæwiʒhek,4
Relative,bæʕdhæ bæʕmælik ʒædulæ ʃu ræʔjik,4
Relative,bæʕmælik ʒædulæ ʃu ræʔjik bitħibel,4
Relative,ʒædulæ ʃu ræʔjik bitħibel ʒædulæ,4
Relative,hæjik rækkæbti wæħæd weneθ θæni,4
Relative,rækkæbti wæħæd weneθ θæni biʒuz,4
Relative,wæħæd weneθ θæni biʒuz wiqiʕ,4
Relative,weneθ θæni biʒuz wiqiʕ hon,4
Relative,θæni biʒuz wiqiʕ hon tæʕæli,4
Relative,biʒuz wiqiʕ hon tæʕæli nʃuf,4
Relative,wiqiʕ hon tæʕæli nʃuf qumi,4
Relative,hon tæʕæli nʃuf qumi biʒuz,4
Relative,tæʕæli nʃuf qumi biʒuz ʕæleki,4
Relative,bæs meʃ næfsul ħælæʔ xudi,4
Relative,meʃ næfsul ħælæʔ xudi ɣæjri,4
Relative,næfsul ħælæʔ xudi ɣæjri hæd,4
Relative,ħælæʔ xudi ɣæjri hæd ʔesˤ,4
Relative,xudi ɣæjri hæd ʔesˤ sˤaħ,4
Relative,ɣæjri hæd ʔesˤ sˤaħ ʃatrˤa,4
Relative,hæd ʔesˤ sˤaħ ʃatrˤa btiʕræfi,4
Relative,ʔesˤ sˤaħ ʃatrˤa btiʕræfi tfæwti,4
Relative,xudi zæbtˤilij jæh meʃ jitˤub,4
Relative,zæbtˤilij jæh meʃ jitˤub beʕjuni,4
Relative,tˤajjib ħæwli biddek ræbatˤa θænjæ,4
Relative,ħæwli biddek ræbatˤa θænjæ ʃu,4
Relative,biddek ræbatˤa θænjæ ʃu lonhæ,4
Relative,ʔah batˤala bilʕæks læzim hek,4
Relative,batˤala bilʕæks læzim hek læzim,4
Relative,bilʕæks læzim hek læzim ʔiʒri,4
Relative,læzim hek læzim ʔiʒri batˤala,4
Relative,hek læzim ʔiʒri batˤala ʔah,4
Relative,læzim ʔiʒri batˤala ʔah ʕmilti,4
Relative,ʔiʒri batˤala ʔah ʕmilti læ,4
Relative,batˤala ʔah ʕmilti læ hæd,4
Relative,ʔah ʕmilti læ hæd whæd,4
Relative,ʕmilti læ hæd whæd tˤajjib,4
Relative,læ hæd whæd tˤajjib ʃu,4
Relative,hæd whæd tˤajjib ʃu ræʔjik,4
Relative,whæd tˤajjib ʃu ræʔjik nħutˤ,4
Relative,tˤajjib ʃu ræʔjik nħutˤ ħælæq,4
Relative,ʔæsæʕdik hæti ʔæsæʕdik meʃ ʕærfæ,4
Relative,hæti ʔæsæʕdik meʃ ʕærfæ hætæ,4
Relative,ʔæsæʕdik meʃ ʕærfæ hætæ ʔænæ,4
Relative,meʃ ʕærfæ hætæ ʔænæ ʔæʕmæl,4
Relative,ʕærfæ hætæ ʔænæ ʔæʕmæl dænhæ,4
Relative,hætæ ʔænæ ʔæʕmæl dænhæ sˤɣiræ,4
Relative,ʔænæ ʔæʕmæl dænhæ sˤɣiræ tæʕæli,4
Relative,ʔæʕmæl dænhæ sˤɣiræ tæʕæli nʒærib,4
Relative,dænhæ sˤɣiræ tæʕæli nʒærib hæj,4
Relative,sˤɣiræ tæʕæli nʒærib hæj ʃu,4
Relative,tæʕæli nʒærib hæj ʃu ræʔjek,4
Relative,kæmæn sˤɣir wkæmæn sˤɣir ʔah,4
Relative,sˤɣir wkæmæn sˤɣir ʔah hæj,4
Relative,wkæmæn sˤɣir ʔah hæj ħuætˤihæ,4
Relative,sˤɣir ʔah hæj ħuætˤihæ wenel,4
Relative,ʔah hæj ħuætˤihæ wenel ħælæq,4
Relative,hæj ħuætˤihæ wenel ħælæq ʔeθ,4
Relative,ħuætˤihæ wenel ħælæq ʔeθ θæni,4
Relative,wenel ħælæq ʔeθ θæni xudi,4
Relative,ħælæq ʔeθ θæni xudi ɣæjrilhæj,4
Relative,ʔeθ θæni xudi ɣæjrilhæj jæh,4
Relative,θæni xudi ɣæjrilhæj jæh ʃu,4
Relative,xudi ɣæjrilhæj jæh ʃu hæd,4
Relative,ɣæjrilhæj jæh ʃu hæd mæ,4
Relative,jæh ʃu hæd mæ ħækætili,4
Relative,ʃu hæd mæ ħækætili ʔiʃi,4
Relative,hæd mæ ħækætili ʔiʃi ʕæl,4
Relative,mæ ħækætili ʔiʃi ʕæl jutjub,4
Relative,ʃu biʕmælu fihædel beɪbi belæwnu,4
Relative,batˤala ʔeħkili ʃu ʕmiltiel jom,4
Relative,ʔeħkili ʃu ʕmiltiel jom ʃu,4
Relative,ʃu ʕmiltiel jom ʃu ʔækælti,4
Relative,ʕmiltiel jom ʃu ʔækælti ʕælef,4
Relative,jom ʃu ʔækælti ʕælef ftˤur,4
Relative,ʃu ʔækælti ʕælef ftˤur ʔækælti,4
Relative,ʔækælti ʕælef ftˤur ʔækælti ruz,4
Relative,ʔænæ bælefilek diri bælek tewqæʕi,4
Relative,bælefilek diri bælek tewqæʕi ʔuwʕi,4
Relative,bæssæʒel bisˤotik læʔinu sˤotik ħilu,4
Relative,bisˤotik læʔinu sˤotik ħilu btiʕræfi,4
Relative,læʔinu sˤotik ħilu btiʕræfi tɣæni,4
Relative,tˤabtˤaba tˤab ɣæni ʔænæ læʔit,4
Relative,tˤab ɣæni ʔænæ læʔit ʔetˤ,4
Relative,ɣæni ʔænæ læʔit ʔetˤ tˤabtˤaba,4
Relative,meʃ ʕærfæ beʃ ʃuɣul jimken,4
Relative,beʃ ʃuɣul tˤajjib wen ʕæmir,4
Relative,tˤallaʕi mæħlæhæ læmmæ ħætˤætilhæ ħælæq,4
Relative,mæħlæhæ læmmæ ħætˤætilhæ ħælæq ʔah,4
Relative,læmmæ ħætˤætilhæ ħælæq ʔah ʔestæni,4
Relative,ħætˤætilhæ ħælæq ʔah ʔestæni wenhæ,4
Relative,ʔeʕmælhæ bihæd fæħisˤ ʔed dæn,4
Relative,xalasˤ ʔæħutˤhæ sˤaræt tæmæm mniħæ,4
Relative,ʔah ʔæʃuf qimilhæ ʔijæh qimtilhæl,4
Relative,ʔæʃuf qimilhæ ʔijæh qimtilhæl ħælæq,4
Relative,qimilhæ ʔijæh qimtilhæl ħælæq ʕæʃæn,4
Relative,ʔijæh qimtilhæl ħælæq ʕæʃæn mæ,4
Relative,qimtilhæl ħælæq ʕæʃæn mæ jdˤiʕ,4
Relative,ħælæq ʕæʃæn mæ jdˤiʕ tˤajjib,4
Relative,bæqdær ʔæʃælħik ʔel bot ʕæʃæn,4
Relative,ʔæʃælħik ʔel bot ʕæʃæn ʕæt,4
Relative,ʔel bot ʕæʃæn ʕæt tæxit,4
Relative,ħilu botik min ʃærælik ʔijæh,4
Relative,ʔæʃuf weno wærʒini meʃ ʃæjfæ,4
Relative,sˤaħiħ kæmæn mærræ ʔeʃ ʃu,4
Relative,kæmæn mærræ ʔeʃ ʃu biddek,4
Relative,mærræ ʔeʃ ʃu biddek twærʒini,4
Relative,ħutˤi hon mænækir meʃ mbæjen,4
Relative,ʔah whon feʃ mænækir mbæjen,4
Relative,ʔah whon feʃ mænækir ʔah,4
Relative,whon feʃ mænækir ʔah fi,4
Relative,feʃ mænækir ʔah fi ʔæħmær,4
Relative,mænækir ʔah fi ʔæħmær feʃ,4
Relative,ʔah fi ʔæħmær feʃ ʕæ,4
Relative,fi ʔæħmær feʃ ʕæ riʒil,4
Relative,ʔæħmær feʃ ʕæ riʒil ʔah,4
Relative,feʃ ʕæ riʒil ʔah wriʒil,4
Relative,ʕæ riʒil ʔah wriʒil læʔ,4
Relative,hæd tum ʔæmiræ hæd meʃ,4
Relative,tum ʔæmiræ hæd meʃ tum,4
Relative,ʔæmiræ hæd meʃ tum ʔæmiræ,4
Relative,mæmnuʕ tækli beʒræbætik btiʕrifi tilbisi,4
Relative,tækli beʒræbætik btiʕrifi tilbisi xælini,4
Relative,beʒræbætik btiʕrifi tilbisi xælini ʔælæbsik,4
Relative,btiʕrifi tilbisi xælini ʔælæbsik xælasˤ,4
Relative,tilbisi xælini ʔælæbsik xælasˤ jinæmu,4
Relative,xælini ʔælæbsik xælasˤ jinæmu tæʕi,4
Relative,ʔælæbsik xælasˤ jinæmu tæʕi ʔen,4
Relative,xælasˤ jinæmu tæʕi ʔen næjmhum,4
Relative,jalla xælihæ tnæm jælla tnæm,4
Relative,ʔiħkili qisˤa ħilwæ ʕæʃæn ʔænæm,4
Relative,qisˤa ħilwæ ʕæʃæn ʔænæm jælla,4
Relative,ħilwæ ʕæʃæn ʔænæm jælla ʃu,4
Relative,ʕæʃæn ʔænæm jælla ʃu biddek,4
Relative,ʔænæm jælla ʃu biddek tiħkili,4
Relative,ʔah ħutˤihum w kæmæn hæj,4
Relative,ħutˤihum w kæmæn hæj jælla,4
Relative,w kæmæn hæj jælla tæʕæli,4
Relative,kæmæn hæj jælla tæʕæli ʔiħkili,4
Relative,hæj jælla tæʕæli ʔiħkili ʔiʃi,4
Relative,jælla tæʕæli ʔiħkili ʔiʃi qisˤa,4
Relative,tæʕæli ʔiħkili ʔiʃi qisˤa qisˤit,4
Relative,ʔiħkili ʔiʃi qisˤa qisˤit ʔes,4
Relative,ʔiʃi qisˤa qisˤit ʔes sulħæfæ,4
Relative,qisˤa qisˤit ʔes sulħæfæ ʃu,4
Relative,qisˤit ʔes sulħæfæ ʃu hæj,4
Relative,tˤajjib ʃu sˤar bes sulħæfæ,4
Relative,ʔah ʔel ʔærnub kæn zæʕlæn,4
Relative,ʔæqum tˤajjib xærfini wʔinti tmæʃtˤili,4
Relative,tˤajjib xærfini kæmæn wæħdæ ʔah,4
Relative,xærfini kæmæn wæħdæ ʔah ʃu,4
Relative,kæmæn wæħdæ ʔah ʃu biddek,4
Relative,wæħdæ ʔah ʃu biddek txærfini,4
Relative,ræħ ʕælæ darhum wxælæsˤat ʔel,4
Relative,ʕælæ darhum wxælæsˤat ʔel qisˤa,4
Relative,ħilwæ wfætutæ tˤajjib fi kæmæn,4
Relative,wfætutæ tˤajjib fi kæmæn qisˤa,4
Relative,tˤajjib fi kæmæn qisˤa mæθælæn,4
Relative,fi kæmæn qisˤa mæθælæn ʕænel,4
Relative,kæmæn qisˤa mæθælæn ʕænel ʔæsæd,4
Relative,qisˤa mæθælæn ʕænel ʔæsæd ʔah,4
Relative,mæθælæn ʕænel ʔæsæd ʔah ʃu,4
Relative,ʕænel ʔæsæd ʔah ʃu qisˤsˤet,4
Relative,ʔæsæd ʔah ʃu qisˤsˤet ʔel,4
Relative,ʔah ʃu qisˤsˤet ʔel ʔæsæd,4
Relative,tˤajjib biddek tquli kæmæn ʔiʃi,4
Relative,ʕælæ wiʒhik ʃu ræsæmti ʕælæ,4
Relative,wiʒhik ʃu ræsæmti ʕælæ wiʒhik,4
Relative,ʔænæ læʔ bidiʃ txærbiʃi ʕæ,4
Relative,læʔ bidiʃ txærbiʃi ʕæ ʔidi,4
Relative,ʒibi wæræqæ wʔursumi ʃu mæ,4
Relative,wæræqæ wʔursumi ʃu mæ biddek,4
Relative,læʔ kæræzæ meʃ wærdæ kæræzæ,4
Relative,kæræzæ meʃ wærdæ kæræzæ fækihæ,4
Relative,meʃ wærdæ kæræzæ fækihæ ʔel,4
Relative,wærdæ kæræzæ fækihæ ʔel wærdæ,4
Relative,kæræzæ fækihæ ʔel wærdæ wærdæ,4
Relative,fækihæ ʔel wærdæ wærdæ jalla,4
Relative,ʔel wærdæ wærdæ jalla bidkeʃ,4
Relative,wærdæ wærdæ jalla bidkeʃ txærfini,4
Relative,mæhu ʔel kæræz bæs besˤ,4
Relative,ʔel kæræz bæs besˤ sˤef,4
Relative,kæræz bæs besˤ sˤef bitʕlæʕeʃ,4
Relative,bæs besˤ sˤef bitʕlæʕeʃ beʃ,4
Relative,besˤ sˤef bitʕlæʕeʃ beʃ ʃitæ,4
Relative,sˤef bitʕlæʕeʃ beʃ ʃitæ jæʕni,4
Relative,bitʕlæʕeʃ beʃ ʃitæ jæʕni kæmæn,4
Relative,beʃ ʃitæ jæʕni kæmæn ʃwæj,4
Relative,ʃitæ jæʕni kæmæn ʃwæj bitˤlæʕ,4
Relative,kbir kbir xalasˤ sido boxidkum,4
Relative,kbir xalasˤ sido boxidkum bitruħi,4
Relative,xalasˤ sido boxidkum bitruħi tlæqtˤi,4
Relative,sido boxidkum bitruħi tlæqtˤi kæræz,4
Relative,boxidkum bitruħi tlæqtˤi kæræz jalla,4
Relative,bitruħi tlæqtˤi kæræz jalla meʃ,4
Relative,tlæqtˤi kæræz jalla meʃ ħækætili,4
Relative,kæræz jalla meʃ ħækætili ʔiʃi,4
Relative,jalla meʃ ħækætili ʔiʃi ʕæn,4
Relative,meʃ ħækætili ʔiʃi ʕæn ʔes,4
Relative,ħækætili ʔiʃi ʕæn ʔes sulħæfæ,4
Relative,ʔiʃi ʕæn ʔes sulħæfæ wel,4
Relative,ʕæn ʔes sulħæfæ wel ʔæsæd,4
Relative,tˤajjib jalla xærfini ʕæn ʔes,4
Relative,jalla xærfini ʕæn ʔes sulħæfæ,4
Relative,ʔah wʔebnu mæʕæh wene ʔes,4
Relative,wʔebnu mæʕæh wene ʔes sulħæfæ,4
Relative,mæʕæh wene ʔes sulħæfæ ræħæt,4
Relative,oʊ maɪ gɑd tˤajjib jæ,4
Relative,maɪ gɑd tˤajjib jæ ħæræm,4
Relative,gɑd tˤajjib jæ ħæræm ʔes,4
Relative,tˤajjib jæ ħæræm ʔes sulħæfæ,4
Relative,jæ ħæræm ʔes sulħæfæ mitxæbjæ,4
Relative,wel ʔæsæd ʔesˤ sˤɣir ʃu,4
Relative,ʔæsæd ʔesˤ sˤɣir ʃu sˤar,4
Relative,ʔesˤ sˤɣir ʃu sˤar fih,4
Relative,ʔes sulħæfæ ʕadˤdˤat ʔel ʔæsæd,4
Relative,sulħæfæ ʕadˤdˤat ʔel ʔæsæd ʔesˤ,4
Relative,ʕadˤdˤat ʔel ʔæsæd ʔesˤ sˤɣir,4
Relative,læ xalasˤ ħæræm xæli læħælu,4
Relative,ʔes sulħæfæ kæmæn xælihæ mitxæbjæ,4
Relative,sulħæfæ kæmæn xælihæ mitxæbjæ tˤajjib,4
Relative,kæmæn xælihæ mitxæbjæ tˤajjib xalasˤ,4
Relative,xælihæ mitxæbjæ tˤajjib xalasˤ tˤajjib,4
Relative,mitxæbjæ tˤajjib xalasˤ tˤajjib ʃu,4
Relative,tˤajjib xalasˤ tˤajjib ʃu sˤar,4
Relative,xalasˤ tˤajjib ʃu sˤar belli,4
Relative,tˤajjib ʃu sˤar belli mæt,4
Relative,ʃu sˤar belli mæt ʃu,4
Relative,sˤar belli mæt ʃu sˤar,4
Relative,belli mæt ʃu sˤar fih,4
Relative,mæt ʃu sˤar fih wen,4
Relative,ʃu sˤar fih wen raħ,4
Relative,ʔel ʔæsæd ʔesˤ sˤɣir læf,4
Relative,ʔæsæd ʔesˤ sˤɣir læf læ,4
Relative,ʔesˤ sˤɣir læf læ lekbir,4
Relative,hæræb ʔen nimer wen ræħ,4
Relative,ʔen nimer wen ræħ ʕind,4
Relative,nimer wen ræħ ʕind leħmær,4
Relative,wen ræħ ʕind leħmær wʃu,4
Relative,ræħ ʕind leħmær wʃu ʕimlu,4
Relative,ʕind leħmær wʃu ʕimlu ʕind,4
Relative,leħmær wʃu ʕimlu ʕind leħmær,4
Relative,ʔinti ʒiti ʕinæ bes sæjjæræ,4
Relative,ʒiti ʕinæ bes sæjjæræ mæʕ,4
Relative,ʕinæ bes sæjjæræ mæʕ sido,4
Relative,ʔah kif ʒiti ʃu ʒæbik,4
Relative,kif ʒiti ʃu ʒæbik mama,4
Relative,ʒiti ʃu ʒæbik mama ʔeli,4
Relative,ʃu ʒæbik mama ʔeli ʒæbætik,4
Relative,ʒæbik mama ʔeli ʒæbætik ʔænu,4
Relative,mama ʔeli ʒæbætik ʔænu ʔeli,4
Relative,ʔeli ʒæbætik ʔænu ʔeli kæn,4
Relative,ʒæbætik ʔænu ʔeli kæn sæjiʔ,4
Relative,tæʕæli biħudˤni ʔæʕmælek derigin derigin,4
Relative,biħudˤni ʔæʕmælek derigin derigin ʃu,4
Relative,ʔæʕmælek derigin derigin ʃu ʔæʕmælek,4
Relative,ʔah bæħutˤilik ʔijæhæ bæs tiʒi,4
Relative,bæħutˤilik ʔijæhæ bæs tiʒi ʕindi,4
Relative,ʔijæhæ bæs tiʒi ʕindi tˤajjib,4
Relative,bæs tiʒi ʕindi tˤajjib derigin,4
Relative,tiʒi ʕindi tˤajjib derigin derigin,4
Relative,ʔænæ tqilæ meʃ ræħ tiʔdæri,4
Relative,læ tæʕæli buzbutiʃ ʔænæ tqilæ,4
Relative,tæʕæli buzbutiʃ ʔænæ tqilæ tæʕæli,4
Relative,buzbutiʃ ʔænæ tqilæ tæʕæli ʔænæ,4
Relative,ʔænæ tqilæ tæʕæli ʔænæ dæʕmælik,4
Relative,tqilæ tæʕæli ʔænæ dæʕmælik kæmæn,4
Relative,tæʕæli ʔænæ dæʕmælik kæmæn mæræ,4
Relative,ʔænæ dæʕmælik kæmæn mæræ wxælasˤ,4
Relative,dæʕmælik kæmæn mæræ wxælasˤ bæʕmælek,4
Relative,kæmæn mæræ wxælasˤ bæʕmælek ʕæli,4
Relative,ʃu kjut xubzet bɜrgər mdæwwæræ,4
Relative,ʃu hæd ʔeli ʔenkæb ʕæl,4
Relative,hæd ʔeli ʔenkæb ʕæl ʔærd,4
Relative,ji tæjus qimi xudi ʔemsikili,4
Relative,tæjus qimi xudi ʔemsikili ʔet,4
Relative,qimi xudi ʔemsikili ʔet tilifon,4
Relative,xudi ʔemsikili ʔet tilifon jalla,4
Relative,ʔemsikili ʔet tilifon jalla tæʔæli,4
Relative,tˤajjib ʔeħkili ʃu fi hon,4
Relative,tirkæbu fi truħu fi riħlæ,4
Relative,benʔæʃer bi ʔeʃ hon benʔæʃir,4
Relative,bi ʔeʃ hon benʔæʃir ʕæleh,4
Relative,ʔeʃ hon benʔæʃir ʕæleh biʔisbæʕ,4
Relative,læʔ ħatˤet ʔido ʕæ ʔeʃ,4
Relative,sˤaħ tæʕæli nkæmil ʔeftæħi bæs,4
Relative,tæʕæli nkæmil ʔeftæħi bæs sˤafħa,4
Relative,nkæmil ʔeftæħi bæs sˤafħa wæħdæ,4
Relative,læʔ ʕælæ ʔeʃ ħatʕit ʔisˤbaʕo,4
Relative,ʔiftæħi minel ʔæwwæl min hon,4
Relative,minel ʔæwwæl min hon lissæ,4
Relative,ʔæwwæl min hon lissæ fi,4
Relative,min hon lissæ fi kæmæn,4
Relative,hon lissæ fi kæmæn wæħdæ,4
Relative,lissæ fi kæmæn wæħdæ wæħdæ,4
Relative,fi kæmæn wæħdæ wæħdæ hon,4
Relative,kæmæn wæħdæ wæħdæ hon jalla,4
Relative,wæħdæ wæħdæ hon jalla ʃufi,4
Relative,wæħdæ hon jalla ʃufi hon,4
Relative,læmmæ tsˤir ħæriqæ btiʒi sijærit,4
Relative,tsˤir ħæriqæ btiʒi sijærit ʔel,4
Relative,ħæriqæ btiʒi sijærit ʔel ʔitˤfaʔ,4
Relative,btiʒi sijærit ʔel ʔitˤfaʔ wbetetˤfi,4
Relative,sijærit ʔel ʔitˤfaʔ wbetetˤfi ʔen,4
Relative,ʔel ʔitˤfaʔ wbetetˤfi ʔen nar,4
Relative,tiʒi tiʕmæli wi bsurʕæ bsurʕæ,4
Relative,tiʕmæli wi bsurʕæ bsurʕæ btiʒi,4
Relative,wi bsurʕæ bsurʕæ btiʒi ʕæʃæn,4
Relative,bsurʕæ bsurʕæ btiʒi ʕæʃæn titˤfi,4
Relative,bsurʕæ btiʒi ʕæʃæn titˤfi ʔel,4
Relative,btiʒi ʕæʃæn titˤfi ʔel ħæriqæ,4
Relative,ʕæʃæn titˤfi ʔel ħæriqæ mæ,4
Relative,titˤfi ʔel ħæriqæ mæ jsˤir,4
Relative,ʔel ħæriqæ mæ jsˤir ħæriqæ,4
Relative,ħæriqæ mæ jsˤir ħæriqæ kbir,4
Relative,mæ jsˤir ħæriqæ kbir wjinħireʔ,4
Relative,jsˤir ħæriqæ kbir wjinħireʔ kulʃi,4
Relative,ħæriqæ kbir wjinħireʔ kulʃi sˤaħ,4
Relative,ʔah wlæmmæ tkun ʔed dinjæ,4
Relative,wlæmmæ tkun ʔed dinjæ ʃæmis,4
Relative,tkun ʔed dinjæ ʃæmis ʃu,4
Relative,ʔed dinjæ ʃæmis ʃu bitsˤir,4
Relative,dinjæ ʃæmis ʃu bitsˤir bel,4
Relative,ʃæmis ʃu bitsˤir bel buzæ,4
Relative,ʃu bitsˤir bel buzæ læmmæ,4
Relative,bitsˤir bel buzæ læmmæ tkun,4
Relative,bel buzæ læmmæ tkun ʔed,4
Relative,buzæ læmmæ tkun ʔed dinjæ,4
Relative,læmmæ tkun ʔed dinjæ ħæm,4
Relative,tkun ʔed dinjæ ħæm ħæm,4
Relative,nilħæs bsurʕæ ʕæʃæn mæ tsiħ,4
Relative,sˤaħ ʃikilhæ zæj ʔel bet,4
Relative,ʃikilhæ zæj ʔel bet bruħu,4
Relative,zæj ʔel bet bruħu lewlæd,4
Relative,ʔel bet bruħu lewlæd ʃu,4
Relative,bet bruħu lewlæd ʃu jiʕmælu,4
Relative,bilʕæbu ʃu kæmæn biʕmælu bel,4
Relative,ʃu kæmæn biʕmælu bel mædræsæ,4
Relative,ʃu buzæ bel ʔinglizi aɪs,4
Relative,wbel ʔinglizi ʃu binqul ʕænel,4
Relative,ʔinglizi ʃu binqul ʕænel mætˤar,4
Relative,læmmæ nʃim ʔel wærdæ ʃu,4
Relative,nʃim ʔel wærdæ ʃu riħithæ,4
Relative,ʔel wærdæ ʃu riħithæ bitkun,4
Relative,sˤaħ tˤajjaræ wen bitruħ ʔetˤ,4
Relative,tˤajjaræ wen bitruħ ʔetˤ tˤajara,4
Relative,bærdˤo hæj hɛlɪkɑptər bærdˤo bitruħ,4
Relative,hæj hɛlɪkɑptər bærdˤo bitruħ ʕæs,4
Relative,hɛlɪkɑptər bærdˤo bitruħ ʕæs sæmæ,4
Relative,ʔeʃ hæd ʕiz ræmædˤan kærim,4
Relative,ʃu mælæk jæ k ær,4
Relative,mælæk jæ k ær æm,4
Relative,kæræm ʔembæriħ ʔintæ wbaba ʃu,4
Relative,ʔembæriħ ʔintæ wbaba ʃu kuntu,4
Relative,leʃ baba ziʕil minæk ʔembæriħ,4
Relative,ʔah le ʃu kunt ʔet,4
Relative,le ʃu kunt ʔet ʕæjjetsˤ,4
Relative,ʃu ħækælæk mħæmæd leʃ ʔintæ,4
Relative,ħækælæk mħæmæd leʃ ʔintæ zʕilit,4
Relative,mħæmæd leʃ ʔintæ zʕilit mino,4
Relative,ʔah ʃu ħæket læ mama,4
Relative,whi mama kæn ʕindhæ ħisˤsˤa,4
Relative,kænæt tæʕtˤi ħisˤsˤa læl bænæt,4
Relative,ʃu mælhin ʔel bætˤarijæt baba,4
Relative,mælhin ʔel bætˤarijæt baba ħækælæk,4
Relative,ʔel bætˤarijæt baba ħækælæk tħutˤilo,4
Relative,bætˤarijæt baba ħækælæk tħutˤilo ʕæl,4
Relative,baba ħækælæk tħutˤilo ʕæl ʔæxbær,4
Relative,wʃu mælhinel bætʕarijæt fer rimot,4
Relative,læʔ læʔ bæs ʕæhæj ʔesˤ,4
Relative,læʔ bæs ʕæhæj ʔesˤ sˤafħa,4
Relative,bæs ʕæhæj ʔesˤ sˤafħa ʔuktub,4
Relative,tˤajjib xalasˤ hæj hon fadˤi,4
Relative,xalasˤ hæj hon fadˤi fadˤi,4
Relative,hæj hon fadˤi fadˤi jalla,4
Relative,hon fadˤi fadˤi jalla niʕmæl,4
Relative,fadˤi fadˤi jalla niʕmæl hek,4
Relative,fadˤi jalla niʕmæl hek xatˤ,4
Relative,jalla niʕmæl hek xatˤ whek,4
Relative,tˤajjib jallah ʃu biddæk tursum,4
Relative,læmmæ ħatˤet læ baba ʕæl,4
Relative,læ baba ʕæl ʔæxbar tˤajjib,4
Relative,baba ʕæl ʔæxbar tˤajjib wbæʔden,4
Relative,ʕæn ʔel bissæ tˤajjib ʔiħkili,4
Relative,ʔel bissæ tˤajjib ʔiħkili hæj,4
Relative,bissæ tˤajjib ʔiħkili hæj ʔænæ,4
Relative,tˤajjib ʔiħkili hæj ʔænæ bæsmæʕæk,4
Relative,nilʕæb bel ligo wilæ bil,4
Relative,bel ligo wilæ bil bitˤaqat,4
Relative,ʔiħkili qisˤa wʔintæ bitsæwi ligo,4
Relative,ʃu ħækætil ʕænzæ ʃu ħækæt,4
Relative,ʃu ħækæ ʔeð ðiʔib jallæ,4
Relative,ħækæ ʔeð ðiʔib jallæ kæmil,4
Relative,ʔel kælib ʔæxð ʔel ʔæɣradˤ,4
Relative,kælib ʔæxð ʔel ʔæɣradˤ mine,4
Relative,ʔæxð ʔel ʔæɣradˤ mine ʔeð,4
Relative,ʔel ʔæɣradˤ mine ʔeð ðiʔib,4
Relative,ʃu miʃ zæbbætˤetˤ ʔel ligo,4
Relative,leʃ læ buzbutˤiʃ minʃæn fihæ,4
Relative,læ buzbutˤiʃ minʃæn fihæ ʕæʒælæt,4
Relative,buzbutˤiʃ minʃæn fihæ ʕæʒælæt minʃæn,4
Relative,minʃæn fihæ ʕæʒælæt minʃæn ʔintæ,4
Relative,fihæ ʕæʒælæt minʃæn ʔintæ tħutˤhæ,4
Relative,ʕæʒælæt minʃæn ʔintæ tħutˤhæ fil,4
Relative,minʃæn ʔintæ tħutˤhæ fil ligo,4
Relative,ʔintæ tħutˤhæ fil ligo min,4
Relative,tħutˤhæ fil ligo min tæħit,4
Relative,fil ligo min tæħit minʃæn,4
Relative,ligo min tæħit minʃæn tsˤir,4
Relative,min tæħit minʃæn tsˤir timʃi,4
Relative,ʕærif tˤajib ʃwæj ʃwæj ʔisˤħa,4
Relative,tˤajib ʃwæj ʃwæj ʔisˤħa ʔisˤħa,4
Relative,tæʕæl nfikhum wino ʃu fi,4
Relative,nfikhum wino ʃu fi ʔælwæn,4
Relative,tˤajjib xælasˤ jallæ ʔiħkili ʔel,4
Relative,xælasˤ jallæ ʔiħkili ʔel ʔælwæn,4
Relative,jallæ ʔiħkili ʔel ʔælwæn jæli,4
Relative,ʔiħkili ʔel ʔælwæn jæli fil,4
Relative,ʔel ʔælwæn jæli fil ligo,4
Relative,ʃul ʔælwæn jæli fil ligo,4
Relative,ʔælwæn jæli fil ligo ʔiħkilil,4
Relative,sˤaħ ʃætˤur ʃu kæmæn ʔælwæn,4
Relative,sˤaħ wʃu hæd ʔeʃ ʃækil,4
Relative,tˤajjib kæmæn ʔiħkili ruħit ʕælæ,4
Relative,kæmæn ʔiħkili ruħit ʕælæ xaltu,4
Relative,ʔiħkili ruħit ʕælæ xaltu ruqqajæ,4
Relative,biddæk tuktub tˤajjib jallæ ʔuktub,4
Relative,kæræm ʔimbæriħ ʔintæ wbaba ʃu,4
Relative,ʔimbæriħ ʔintæ wbaba ʃu kuntu,4
Relative,leʃ baba ziʕil minæk ʔimbæriħ,4
Relative,ʃu ħækælæk ʃu ħækælæk mħæmæd,4
Relative,hijjæ mama kæn ʕindhæ ħisˤa,4
Relative,kænæt tæʕtˤi ħisˤa læl bænæt,4
Relative,ʃu mælhum ʔel bætˤarijæt wbaba,4
Relative,mælhum ʔel bætˤarijæt wbaba ħækælæk,4
Relative,ʔel bætˤarijæt wbaba ħækælæk tħutˤilo,4
Relative,bætˤarijæt wbaba ħækælæk tħutˤilo ʕæl,4
Relative,wbaba ħækælæk tħutˤilo ʕæl ʔæxbar,4
Relative,ʃu mælhum ʔel bætˤarijæt fir,4
Relative,mælhum ʔel bætˤarijæt fir rimot,4
Relative,tˤajjib kæmil kæmil læ læ,4
Relative,kæmil kæmil læ læ bæs,4
Relative,kæmil læ læ bæs ʕælæ,4
Relative,læ læ bæs ʕælæ hæj,4
Relative,læ bæs ʕælæ hæj ʔesˤ,4
Relative,bæs ʕælæ hæj ʔesˤ sˤafħa,4
Relative,ʕælæ hæj ʔesˤ sˤafħa ʔuktub,4
Relative,tˤajjib w bæʕden læmæ ħatˤet,4
Relative,w bæʕden læmæ ħatˤet læ,4
Relative,bæʕden læmæ ħatˤet læ baba,4
Relative,læmæ ħatˤet læ baba ʕæl,4
Relative,læ baba ʕæl ʔæxbar ʃu,4
Relative,baba ʕæl ʔæxbar ʃu sˤar,4
Relative,ʕæl ʔæxbar ʃu sˤar kæmmil,4
Relative,jallah nbæliʃ nilʕæb nsæwi sæfinæ,4
Relative,nbæliʃ nilʕæb nsæwi sæfinæ bel,4
Relative,nilʕæb nsæwi sæfinæ bel ligo,4
Relative,sˤaħ tˤajjib ʔiħkili ʃul fusˤulel,4
Relative,tˤajjib ʔiħkili ʃul fusˤulel ʔærbæʕæ,4
Relative,tˤajjib ʔiħkili ʔæj ʃi wʔænæ,4
Relative,ʔiħkili ʔæj ʃi wʔænæ bækæmil,4
Relative,ʔæj ʃi wʔænæ bækæmil mæʕæk,4
Relative,ʃi wʔænæ bækæmil mæʕæk ʃul,4
Relative,wʔænæ bækæmil mæʕæk ʃul fusˤulel,4
Relative,bækæmil mæʕæk ʃul fusˤulel ʔærbæʕæ,4
Relative,mæʕæk ʃul fusˤulel ʔærbæʕæ ʔeli,4
Relative,ʃul fusˤulel ʔærbæʕæ ʔeli ʕæl,4
Relative,fusˤulel ʔærbæʕæ ʔeli ʕæl læmæthum,4
Relative,ʔærbæʕæ ʔeli ʕæl læmæthum ʔilæk,4
Relative,ʔeli ʕæl læmæthum ʔilæk mama,4
Relative,ʔah ʃu kæmæn fæsˤler ræ,4
Relative,ʔæjwæ jallah ʔiħki ʔer ræbiʕ,4
Relative,sˤef ʃu binsæwi ʔiħnæ befasˤl,4
Relative,ʃu binsæwi ʔiħnæ befasˤl ʔesˤ,4
Relative,binsæwi ʔiħnæ befasˤl ʔesˤ sˤef,4
Relative,ʔiħnæ befasˤl ʔesˤ sˤef wen,4
Relative,befasˤl ʔesˤ sˤef wen binruħ,4
Relative,ʔesˤ sˤef wen binruħ befasˤl,4
Relative,sˤef wen binruħ befasˤl ʔesˤ,4
Relative,wen binruħ befasˤl ʔesˤ sˤef,4
Relative,binruħ befasˤl ʔesˤ sˤef jallah,4
Relative,befasˤl ʔesˤ sˤef jallah ʔiħkili,4
Relative,ʔesˤ sˤef jallah ʔiħkili wen,4
Relative,sˤef jallah ʔiħkili wen binruħ,4
Relative,jallah ʔiħkili wen binruħ ʔah,4
Relative,wʃu kæmæn biddæk tsæwi ʔiħkili,4
Relative,kæmæn biddæk tsæwi ʔiħkili ʔah,4
Relative,biddæk tsæwi ʔiħkili ʔah tˤajjib,4
Relative,tsæwi ʔiħkili ʔah tˤajjib ʕiddili,4
Relative,ʔiħkili ʔah tˤajjib ʕiddili læl,4
Relative,ʔah tˤajjib ʕiddili læl ʕæʃæræ,4
Relative,sˤef ʃu binsæwi ʔiħnæ besˤ,4
Relative,ʃu binsæwi ʔiħnæ besˤ sˤef,4
Relative,binsæwi ʔiħnæ besˤ sˤef meʃ,4
Relative,ʔiħnæ besˤ sˤef meʃ binruħ,4
Relative,besˤ sˤef meʃ binruħ bnisbæħ,4
Relative,sˤef meʃ binruħ bnisbæħ besˤ,4
Relative,meʃ binruħ bnisbæħ besˤ sˤef,4
Relative,binruħ bnisbæħ besˤ sˤef nitˤlaʕ,4
Relative,bnisbæħ besˤ sˤef nitˤlaʕ riħlæt,4
