Mother,ʃwæj ʃul jom ʕæmuræ btiʕræf,4
Mother,ʃul jom ʕæmuræ btiʕræf ʔah,4
Mother,jom ʕæmuræ btiʕræf ʔah xæmsæ,4
Mother,ʕæmuræ btiʕræf ʔah xæmsæ wʕiʃrin,4
Mother,btiʕræf ʔah xæmsæ wʕiʃrin ʃwæj,4
Mother,ʔah xæmsæ wʕiʃrin ʃwæj jæ,4
Mother,xæmsæ wʕiʃrin ʃwæj jæ mama,4
Mother,wʕiʃrin ʃwæj jæ mama ʃwæj,4
Mother,ʃwæj jæ mama ʃwæj jæ,4
Mother,jæ mama ʃwæj jæ ħæbibi,4
Mother,mama ʃwæj jæ ħæbibi bæs,4
Mother,ʃwæj jæ ħæbibi bæs ʔæktub,4
Mother,jæ ħæbibi bæs ʔæktub ʃu,4
Mother,ħæbibi bæs ʔæktub ʃu ʔæktub,4
Mother,weno ʕæmo ʕæmr ʔintæ ʔismæk,4
Mother,ʕæmo ʕæmr ʔintæ ʔismæk ʕæmr,4
Mother,ʕæmr ʔintæ ʔismæk ʕæmr meʃ,4
Mother,ʔintæ ʔismæk ʕæmr meʃ ʕæmo,4
Mother,ʔismæk ʕæmr meʃ ʕæmo ʕæmr,4
Mother,ʕæmr meʃ ʕæmo ʕæmr ʔiħki,4
Mother,meʃ ʕæmo ʕæmr ʔiħki ʃu,4
Mother,ʕæmo ʕæmr ʔiħki ʃu ʔismæk,4
Mother,ʔismo hæd ʔel qerd jojo,4
Mother,tˤalaʕ kif hæssæ belʕæb ji,4
Mother,kif hæssæ belʕæb ji ʃu,4
Mother,hæssæ belʕæb ji ʃu bokel,4
Mother,belʕæb ji ʃu bokel læʔ,4
Mother,ji ʃu bokel læʔ hæj,4
Mother,ʃu bokel læʔ hæj luʕbito,4
Mother,ʃu hædol ʃu hædol ʔili,4
Mother,hædol ʃu hædol ʔili ʒænb,4
Mother,ʃu hædol ʔili ʒænb ʔel,4
Mother,hædol ʔili ʒænb ʔel qerd,4
Mother,ʔæjwæ dir bælæk jduk rasæk,4
Mother,tˤajjib mæhu ʔinzil qimo ʕænel,4
Mother,mæhu ʔinzil qimo ʕænel ʔæredˤ,4
Mother,ʔinzil qimo ʕænel ʔæredˤ wnutˤ,4
Mother,qimo ʕænel ʔæredˤ wnutˤ bæs,4
Mother,ʕænel ʔæredˤ wnutˤ bæs ʕæl,4
Mother,ʔæredˤ wnutˤ bæs ʕæl ʔæredˤ,4
Mother,wnutˤ bæs ʕæl ʔæredˤ mæ,4
Mother,bæs ʕæl ʔæredˤ mæ titˤlaʕ,4
Mother,ʕæl ʔæredˤ mæ titˤlaʕ foq,4
Mother,ʃwæj ʔænæ bæħeb ʔel ʔæxdˤar,4
Mother,bitxæf min ʔesˤ sˤot ʔel,4
Mother,min ʔesˤ sˤot ʔel ʔælæb,4
Mother,ʔesˤ sˤot ʔel ʔælæb ʔen,4
Mother,sˤot ʔel ʔælæb ʔen nærijæ,4
Mother,tˤajjib mæʃi bæs bidnæ nitʕæʃæ,4
Mother,mæʃi bæs bidnæ nitʕæʃæ ʔæwwæl,4
Mother,ʔel ʔælæm bæs ʕæl wæræʔæ,4
Mother,ʔælæm bæs ʕæl wæræʔæ miʃ,4
Mother,bæs ʕæl wæræʔæ miʃ ʕæl,4
Mother,ʕæl wæræʔæ miʃ ʕæl kænæbæj,4
Mother,wæræʔæ miʃ ʕæl kænæbæj ʕizo,4
Mother,hæju bi ʔiʒer ʕez ʔel,4
Mother,bi ʔiʒer ʕez ʔel bot,4
Mother,sˤaħ ʃu ʔisim mama ʕezo,4
Mother,jallæ ʔeʃ biddæk tursum bil,4
Mother,ʔeʃ biddæk tursum bil ʔælæm,4
Mother,biddæk tursum hæbi jallæ nursum,4
Mother,tursum hæbi jallæ nursum hæbi,4
Mother,hæbi jallæ nursum hæbi hæbi,4
Mother,jallæ ʔunfox ʕæ ʃæmʕitil hæbi,4
Mother,kæmæn hæbi jallæ hæpi bɜrθdeɪ,4
Mother,hæbi jallæ hæpi bɜrθdeɪ tu,4
Mother,jallæ hæpi bɜrθdeɪ tu ju,4
Mother,tˤajjib ʔintæ ʃu bitʃuf ʕæl,4
Mother,ʔintæ ʃu bitʃuf ʕæl ʔæxbær,4
Mother,ʃu bitʃuf ʕæl ʔæxbær ʃu,4
Mother,bitʃuf ʕæl ʔæxbær ʃu fi,4
Mother,ʕæl ʔæxbær ʃu fi ʕæl,4
Mother,ʔæxbær ʃu fi ʕæl ʔæxbær,4
Mother,kif wælæ ʔiʃi ʃu bitʃuf,4
Mother,wælæ ʔiʃi ʃu bitʃuf ʕæl,4
Mother,ʔiʃi ʃu bitʃuf ʕæl ʔæxbær,4
Mother,ʃu bitʃuf ʕæl ʔæxbær ʔintæ,4
Mother,ʃu biʕmælu hædol ʔez zlæm,4
Mother,tˤajjib min hædol bteʕræfhum btiʕræf,4
Mother,min hædol bteʕræfhum btiʕræf ʔæsmæʔhum,4
Mother,hædol bteʕræfhum btiʕræf ʔæsmæʔhum btiʕræf,4
Mother,bteʕræfhum btiʕræf ʔæsmæʔhum btiʕræf bæjden,4
Mother,btiʕræf ʔæsmæʔhum btiʕræf bæjden btiʕræfo,4
Mother,ʔæsmæʔhum btiʕræf bæjden btiʕræfo ʔiħki,4
Mother,btiʕræf bæjden btiʕræfo ʔiħki ʔiħki,4
Mother,bæjden btiʕræfo ʔiħki ʔiħki mæ,4
Mother,btiʕræfo ʔiħki ʔiħki mæ tʔæʃer,4
Mother,ʔiħki ʔiħki mæ tʔæʃer bteʕræfu,4
Mother,ʔiħki mæ tʔæʃer bteʕræfu btiʕræf,4
Mother,mæ tʔæʃer bteʕræfu btiʕræf min,4
Mother,tʔæʃer bteʕræfu btiʕræf min bæjden,4
Mother,kif læʔ min fæz bel,4
Mother,læʔ min fæz bel ʔintixæbæt,4
Mother,tæʕædul min wen ʒæjbhæ hæj,4
Mother,ʒæjbhæ hæj ʔel mæʕlomæ min,4
Mother,hæj ʔel mæʕlomæ min wen,4
Mother,ʔel mæʕlomæ min wen ʒæjbhæ,4
Mother,mæʕlomæ min wen ʒæjbhæ hæj,4
Mother,tˤajjib ʔiħkili qisˤa qabel mæ,4
Mother,ʔiħkili qisˤa qabel mæ tnæm,4
Mother,qisˤa qabel mæ tnæm ʔiħkili,4
Mother,qabel mæ tnæm ʔiħkili qisˤa,4
Mother,mæ tnæm ʔiħkili qisˤa wnæm,4
Mother,ʔiħkili ʔæj qisˤa biddæk ʔijæhæ,4
Mother,bæs ʔiħki mniħ tiħkiʃ tæxbisˤ,4
Mother,ʔimbælæ ʔimbælæ btiʕræf kul qisˤasˤak,4
Mother,ʔimbælæ btiʕræf kul qisˤasˤak ħilwæ,4
Mother,btiʕræf kul qisˤasˤak ħilwæ jallah,4
Mother,kul qisˤasˤak ħilwæ jallah ʔiħki,4
Mother,qisˤasˤak ħilwæ jallah ʔiħki qisˤa,4
Mother,ħilwæ jallah ʔiħki qisˤa ħilwæ,4
Mother,tˤajjib ʔiħkili qisˤa bæʕden benʃæɣel,4
Mother,ʔiħkili qisˤa bæʕden benʃæɣel ʔet,4
Mother,qisˤa bæʕden benʃæɣel ʔet telfizon,4
Mother,ʔel fæwækeh ʔixtæfu læmmæ ʔækæluhum,4
Mother,fæwækeh ʔixtæfu læmmæ ʔækæluhum ʔel,4
Mother,ʔixtæfu læmmæ ʔækæluhum ʔel ħæjwænæt,4
Mother,læmmæ ʔækæluhum ʔel ħæjwænæt jæʕni,4
Mother,humæ ʔili ʔækælu ʔel læjmun,4
Mother,ʔintæ betħeb hædul ʔel ħæjwænæt,4
Mother,ʔili bixæfu minel ħæjwænæt hæbulin,4
Mother,mħæmmæd ʕæt tælfizjon min hæd,4
Mother,ʔah metell ʔili ʕælektæb ʃu,4
Mother,metell ʔili ʕælektæb ʃu btudrus,4
Mother,ʔili ʕælektæb ʃu btudrus ʕæktæbæk,4
Mother,ʕælektæb ʃu btudrus ʕæktæbæk min,4
Mother,ʃu btudrus ʕæktæbæk min biddærsæk,4
Mother,btudrus ʕæktæbæk min biddærsæk ʃu,4
Mother,ʕæktæbæk min biddærsæk ʃu btudrus,4
Mother,min biddærsæk ʃu btudrus ʔiħki,4
Mother,biddærsæk ʃu btudrus ʔiħki mætʔæʃereʃ,4
Mother,ʔeʃ kæmæn ɣer muræbæʕ wmuθælæθ,4
Mother,sˤaħ ʃætæur ʔintæ mħæmmæd ʔæħkilæk,4
Mother,ʃætæur ʔintæ mħæmmæd ʔæħkilæk ʃu,4
Mother,ʔintæ mħæmmæd ʔæħkilæk ʃu bteʕmæl,4
Mother,tˤajjib mħæmmæd ktæbæk ʔeθ θæni,4
Mother,mħæmmæd ktæbæk ʔeθ θæni ʃu,4
Mother,ktæbæk ʔeθ θæni ʃu fi,4
Mother,ʔeθ θæni ʃu fi ʕæleh,4
Mother,leh betħebhum ʃu biʕmælu humæ,4
Mother,ʔah ʔintæ betħebeʃ tɑm lekbir,4
Mother,ʔintæ betħebeʃ tɑm lekbir bæs,4
Mother,betħebeʃ tɑm lekbir bæs betħeb,4
Mother,tɑm lekbir bæs betħeb ʤɛri,4
Mother,lekbir bæs betħeb ʤɛri lesˤɣir,4
Mother,ʔintæ betħeb tɑm lekbir wilæ,4
Mother,betħeb tɑm lekbir wilæ ʤɛri,4
Mother,tɑm lekbir wilæ ʤɛri lesˤɣir,4
Mother,sˤaħ tˤajjib særæ ʃu betdærsæk,4
Mother,bæs ʕæræbi betdærsæk særæ bidæreskæʃ,4
Mother,ʕæræbi betdærsæk særæ bidæreskæʃ ʔiʃi,4
Mother,betdærsæk særæ bidæreskæʃ ʔiʃi tæni,4
Mother,xalasˤ mæʕnætu ruħ ʕæl ħædˤanæ,4
Mother,mæʕnætu ruħ ʕæl ħædˤanæ ʔudrus,4
Mother,ruħ ʕæl ħædˤanæ ʔudrus ʃu,4
Mother,ʕæl ħædˤanæ ʔudrus ʃu ræʕjæk,4
Mother,wlæmmæ truħ ʕær ræwdˤa bæʕed,4
Mother,truħ ʕær ræwdˤa bæʕed kuronæ,4
Mother,ʕær ræwdˤa bæʕed kuronæ binnæðifhæ,4
Mother,ræwdˤa bæʕed kuronæ binnæðifhæ wbtæxudhæ,4
Mother,xalasˤ biddæk tnæm biddæk tnæm,4
Mother,biddæk tnæm biddæk tnæm læmmæl,4
Mother,tnæm biddæk tnæm læmmæl wæħæd,4
Mother,biddæk tnæm læmmæl wæħæd jnæm,4
Mother,tnæm læmmæl wæħæd jnæm ʃubiħki,4
Mother,jallah sˤħit ʔel wæħæd læmmæ,4
Mother,sˤħit ʔel wæħæd læmmæ jesˤħæ,4
Mother,ʔel wæħæd læmmæ jesˤħæ ʃu,4
Mother,wæħæd læmmæ jesˤħæ ʃu biħki,4
Mother,læmmæ jesˤħæ ʃu biħki tˤajjib,4
Mother,ʔah tˤajjib leʃ sˤħit xalasˤ,4
Mother,tˤajjib leʃ sˤħit xalasˤ ruħ,4
Mother,leʃ sˤħit xalasˤ ruħ nænæm,4
Mother,sˤħit xalasˤ ruħ nænæm jallah,4
Mother,læmmæ ħæd jiʒi meʃ sˤaħbæk,4
Mother,ħæd jiʒi meʃ sˤaħbæk btuqtulu,4
Mother,jiʒi meʃ sˤaħbæk btuqtulu beslæħ,4
Mother,meʃ sˤaħbæk btuqtulu beslæħ kbir,4
Mother,mæ buzbutˤ beslæħ smɔl sˤɣir,4
Mother,ʔah wʔintæ fuzt welæ læʔ,4
Mother,bitˤuxunæ wbixælfunæ ʔeʃ ʃurtˤæ ʔili,4
Mother,wbixælfunæ ʔeʃ ʃurtˤæ ʔili meʃ,4
Mother,ʔeʃ ʃurtˤæ ʔili meʃ sˤaħbinæ,4
Mother,weʃ ʃurtˤæ ʔili sˤaħbinæ ʃætˤurin,4
Mother,ʃurtˤæ ʔili sˤaħbinæ ʃætˤurin sˤaħ,4
Mother,ʃætˤur mħæmmæd ʔintæ betħeb telʕæb,4
Mother,mħæmmæd ʔintæ betħeb telʕæb kæræteh,4
Mother,ʔistænæ min ʕælæmæk ʔiħkilnæ ħæki,4
Mother,min ʕælæmæk ʔiħkilnæ ħæki færʒinæ,4
Mother,ʕælæmæk ʔiħkilnæ ħæki færʒinæ weħkilnæ,4
Mother,ʔoh bteʕmæl hek biʔeʒræk ʃælutˤ,4
Mother,bteʕmæl hek biʔeʒræk ʃælutˤ ʔismu,4
Mother,hu biħkilæk ʔesm ʔel ħærækæ,4
Mother,biħkilæk ʔesm ʔel ħærækæ min,4
Mother,ʔesm ʔel ħærækæ min ʕællæmæk,4
Mother,ʔel ħærækæ min ʕællæmæk ʔesm,4
Mother,ħærækæ min ʕællæmæk ʔesm ʔel,4
Mother,min ʕællæmæk ʔesm ʔel ħærækæ,4
Mother,ʕællæmæk ʔesm ʔel ħærækæ hek,4
Mother,rʒiʕet mæʕ ʕudæj ʕæl kæræteh,4
Mother,mæʕ ʕudæj ʕæl kæræteh ʔintæ,4
Mother,ʕudæj ʕæl kæræteh ʔintæ wbaba,4
Mother,ʕæl kæræteh ʔintæ wbaba ruħtu,4
Mother,kæræteh ʔintæ wbaba ruħtu mæræ,4
Mother,ʔintæ wbaba ruħtu mæræ ʔah,4
Mother,wbaba ruħtu mæræ ʔah welæ,4
Mother,ruħtu mæræ ʔah welæ læʔ,4
Mother,mæræ ʔah welæ læʔ ʔintæ,4
Mother,ʔah welæ læʔ ʔintæ ruħt,4
Mother,welæ læʔ ʔintæ ruħt mæʕ,4
Mother,læʔ ʔintæ ruħt mæʕ ʕudæj,4
Mother,ʔintæ ruħt mæʕ ʕudæj ʕæl,4
Mother,ruħt mæʕ ʕudæj ʕæl kæræteh,4
Mother,biddæk truħ kæræteh læmmæ tikbær,4
Mother,ʔez zælæmæ lekbir ʔeʃ ħækælæk,4
Mother,wentæ biddæk tetkætæl jæʕni wentæ,4
Mother,biddæk tetkætæl jæʕni wentæ biddæk,4
Mother,tetkætæl jæʕni wentæ biddæk truħ,4
Mother,jæʕni wentæ biddæk truħ ʕæl,4
Mother,wentæ biddæk truħ ʕæl kæræteh,4
Mother,ʔah biruħ bæs berʒæʕ wbæxdæk,4
Mother,biruħ bæs berʒæʕ wbæxdæk sˤaħ,4
Mother,wmin kæmæn bido jiʒi mæʕek,4
Mother,kæmæn bido jiʒi mæʕek ʕæl,4
Mother,bido jiʒi mæʕek ʕæl ħæfle,4
Mother,ʃu hædol jæli bitħutˤihum ʕæl,4
Mother,hædol jæli bitħutˤihum ʕæl ʔærdˤ,4
Mother,næjæ ʔæʃræħili ʃu betˤmæli ʃu,4
Mother,ʔæʃræħili ʃu betˤmæli ʃu ħædˤærti,4
Mother,ʃu betˤmæli ʃu ħædˤærti ʔel,4
Mother,betˤmæli ʃu ħædˤærti ʔel jom,4
Mother,ʕæʃæ ʔeʃ ʃu tˤabxæ bel,4
Mother,ʔeʃ ʃu tˤabxæ bel ʕæʃæ,4
Mother,ʔæhwe hæd ʔah ʔæhwet ʔeʃ,4
Mother,hæj bidhæ tiiʒ ʕæl ʕæʃæ,4
Mother,bidhæ tiiʒ ʕæl ʕæʃæ tˤajjib,4
Mother,næjæ btitzækæri læmmæ kunti truħi,4
Mother,btitzækæri læmmæ kunti truħi ʕær,4
Mother,læmmæ kunti truħi ʕær ræwdˤa,4
Mother,ʃu kunti tiʕæmæli ber ræwdˤa,4
Mother,tˤab ʃu ræʔjek niʕmæl xeme,4
Mother,sˤabæħ ʔen nur jæ mama,4
Mother,ʔah ʃu biddek jæ ræhæf,4
Mother,ræhuf wen ruħnæ ʔænæ wijjæki,4
Mother,wen ruħnæ ʔænæ wijjæki wʃædi,4
Mother,ruħnæ ʕæd daktor ʃufnæ silæ,4
Mother,ræhuf ʃu ʃufnæ bilmæħæl bæs,4
Mother,ʃu ʃufnæ bilmæħæl bæs ruħnæ,4
Mother,ʃufnæ bilmæħæl bæs ruħnæ niʃtri,4
Mother,bilmæħæl bæs ruħnæ niʃtri ʔæwæʕi,4
Mother,ʃufti ħsˤan wmin wen mæsæktih,4
Mother,ruħi ʒib ʔell ʔæjbæd ʔenʃuf,4
Mother,ʒib ʔell ʔæjbæd ʔenʃuf sˤiwær,4
Mother,ʔell ʔæjbæd ʔenʃuf sˤiwær ʔel,4
Mother,ʔæjbæd ʔenʃuf sˤiwær ʔel ħæjjwænat,4
Mother,brævo ʃu hæd jæ mama,4
Mother,meʃ mniħæ ʔinti ʔænæ biddi,4
Mother,mniħæ ʔinti ʔænæ biddi ʔæħib,4
Mother,ʔinti ʔænæ biddi ʔæħib silæ,4
Mother,ʔænæ biddi ʔæħib silæ ʔækθær,4
Mother,biddi ʔæħib silæ ʔækθær minnek,4
Mother,brævo ræhufæ hæd ʃu ʔismuh,4
Mother,ʃatˤuræ jæ mama ʃu ʔisim,4
Mother,jæ mama ʃu ʔisim hæd,4
Mother,ji mæħlæʔhæ ʃu hæd jæ,4
Mother,mæħlæʔhæ ʃu hæd jæ mama,4
Mother,ji dˤaʕæt ʔel bællone nædi,4
Mother,dˤaʕæt ʔel bællone nædi ʕælehæ,4
Mother,wen biddek truħ ʔel jom,4
Mother,ræhuf ʃu fi ʕind sido,4
Mother,ji min xarbæʃ ʕæl ħetˤ,4
Mother,ʃatˤuræ hæd læmin læ silæ,4
Mother,ʃatˤuræ ræhuf wen biruħ baba,4
Mother,ræhuf wen biruħ baba ʔesˤ,4
Mother,wen biruħ baba ʔesˤ sˤubeħ,4
Mother,ʃu biʒiblek min ʔeʃ ʃuɣul,4
Mother,ræhuf ʃu ʕæmælnæ ʕæs sætˤeħ,4
Mother,næʃært ʔel ɣasil ʔinti wmama,4
Mother,brævo ʃu mælik jæ ræhæf,4
Mother,minʃæn ʔes suħselæ ʕeb jæ,4
Mother,ʔes suħselæ ʕeb jæ mama,4
Mother,suħselæ ʕeb jæ mama ʃu,4
Mother,ʕeb jæ mama ʃu ʔiʃtæreti,4
Mother,jæ mama ʃu ʔiʃtæreti læ,4
Mother,mama ʃu ʔiʃtæreti læ silæ,4
Mother,hæj ʔilek hæj læ silæ,4
Mother,ʔah ʔiħkilhæ xudi jæ silæ,4
Mother,ʔah kulhum læ silæ hædol,4
Mother,wræhæf wen ʔæɣrædˤhæ ʕindik xæzænæh,4
Mother,hædol læ silæ tilʕæbiʃ fihum,4
Mother,ʃu fi min kætæb ʕæ,4
Mother,fi min kætæb ʕæ ʔidik,4
Mother,ruħti ʕind sido ʔel jom,4
Mother,ħæræm jæ mama ʃu ʔækælti,4
Mother,ħæʒæt ruħtu ʕæd dukænæ ʔiʃtæretu,4
Mother,ruħtu ʕæd dukænæ ʔiʃtæretu ħæʒæt,4
Mother,ʕæd dukænæ ʔiʃtæretu ħæʒæt ʃu,4
Mother,dukænæ ʔiʃtæretu ħæʒæt ʃu ʔiʃtæreti,4
Mother,ræhuf tˤleʕtu biʃ ʃæmis ʔinti,4
Mother,tˤleʕtu biʃ ʃæmis ʔinti wdˤuħæ,4
Mother,ruħtu ʔiʃtæretu min ʔæʕtˤaki ʃekil,4
Mother,ʃætˤuræ tˤab ræhuf ʃu hæd,4
Mother,ræhuf tæʕæli ʔæqulek læmin hæj,4
Mother,læʔ hæd ʔit tilifon læ,4
Mother,hæd ʔit tilifon læ mama,4
Mother,ræhuf ʃufi ʕind sido ħæmama,4
Mother,ʕeb sˤaħ qulilhæ ʕeb jæ,4
Mother,sˤaħ qulilhæ ʕeb jæ ʃæm,4
Mother,ʕeb tudˤurbini biʃu lʕibti ʔel,4
Mother,tudˤurbini biʃu lʕibti ʔel jom,4
Mother,ʃu mama ħætˤatlik ʒuwwæ ʔel,4
Mother,mama ħætˤatlik ʒuwwæ ʔel mæj,4
Mother,ræhuf ʃu hæj ʔel liʕbæ,4
Mother,ʃu ħætˤatlek mama ʕæ timmek,4
Mother,ħomræh ʃætˤuræ ræhuf ʃu btækli,4
Mother,læ hæj ʔel mikwæ læ,4
Mother,hæj ʔel mikwæ læ mama,4
Mother,tˤaj jib mama hæj luʕbæh,4
Mother,læʔ hædæ ʔet tilifon muʃ,4
Mother,hædæ ʔet tilifon muʃ læ,4
Mother,ʔet tilifon muʃ læ ræhæf,4
Mother,tilifon muʃ læ ræhæf hæd,4
Mother,muʃ læ ræhæf hæd læ,4
Mother,læ ræhæf hæd læ mama,4
Mother,ræhuf ʃufi ʕætilifon mama fi,4
Mother,ʃufi ʕætilifon mama fi bissæ,4
Mother,hæd moz ʃætˤuræ ræhuf min,4
Mother,moz ʃætˤuræ ræhuf min ʔæʒæ,4
Mother,ʃætˤuræ ræhuf min ʔæʒæ ʕinnæ,4
Mother,ræhuf min ʔæʒæ ʕinnæ ʔel,4
Mother,min ʔæʒæ ʕinnæ ʔel jom,4
Mother,ʔæʒæ ʕinnæ ʔel jom jalla,4
Mother,ʕinnæ ʔel jom jalla ʔiħki,4
Mother,ʔel jom jalla ʔiħki min,4
Mother,jom jalla ʔiħki min ʔæʒæ,4
Mother,jalla ʔiħki min ʔæʒæ ʕinnæ,4
Mother,wen biddek truħi ræhuf ʃu,4
Mother,biddek truħi ræhuf ʃu hædol,4
Mother,læʔ mama ħilwæh min mæʃʃætˤlik,4
Mother,mama ħilwæh min mæʃʃætˤlik ʃæʕrætek,4
Mother,tæʕæli ræhuf læmin hædolæ ʔel,4
Mother,ræhuf læmin hædolæ ʔel ʔwæʕi,4
Mother,brævo ræhuf ʔiħki bæʒæmæ jalla,4
Mother,læʔ mama silæ bidhæ ħælib,4
Mother,ræhuf mama ʃæræbætek dæwæ ʔel,4
Mother,mama ʃæræbætek dæwæ ʔel jom,4
Mother,ræhuf kænæt mæridˤæ wʃirbæt dæwæ,4
Mother,kul hædol ʔel ʔælʕæb læræhæf,4
Mother,bravo ʃu hæj jæ mama,4
Mother,wen bidnæ nħutˤ ʔel kaʕ,4
Mother,ʃætˤuræ ræhuf wen ʔet tælifon,4
Mother,bravo ʃu ʔæħutˤilek ʒuwæ ʔesˤ,4
Mother,ʃu ʔæħutˤilek ʒuwæ ʔesˤ sˤaħen,4
Mother,ræhuf ʃu mama tˤaʕmætek ʔel,4
Mother,ʃu mama tˤaʕmætek ʔel jom,4
Mother,ʃu tˤaʕmætek ʔel jom mama,4
Mother,bravo ræhuf ʃu biddek tiʕmæli,4
Mother,ræhuf ʃu biddek tiʕmæli bed,4
Mother,ʃu biddek tiʕmæli bed dar,4
Mother,ræhuf ʔuli læ silæ sˤaħæ,4
Mother,min ʔaʕtˤaki ʔijæhum mæ ʔæħlæhum,4
Mother,ræhuf wen ruħti ʔel jom,4
Mother,wen ruħti ʔel jom ʔinti,4
Mother,ruħti ʔel jom ʔinti wdˤuħa,4
Mother,ʔel jom ʔinti wdˤuħa baj,4
Mother,ræhuf ʃu ʒibti læmama ʔel,4
Mother,ʃu ʒibti læmama ʔel jom,4
Mother,ʔinti ʔel ħilwæ ja mama,4
Mother,ʔel ħilwæ ja mama jæ,4
Mother,ħilwæ ja mama jæ ʕumri,4
Mother,ræhuf wen biddek tħutˤi ʔetˤ,4
Mother,wen biddek tħutˤi ʔetˤ tˤubæʕ,4
Mother,xalasˤ jæ mama hædol læ,4
Mother,jæ mama hædol læ silæ,4
Mother,wen bidnæ nħutˤ ʔel kæʕ,4
Mother,læʔ ja mama ræhæf ħilwæ,4
Mother,tæbæʕ mimi ʃu ʔismo ræhuf,4
Mother,ʔel bubu tæbæʕ ræhæf ʃu,4
Mother,bubu tæbæʕ ræhæf ʃu ʔismo,4
Mother,ʔælʕæb quli mama biddi ʔælʕæb,4
Mother,bravo ræhuf ʃu ʒæblek ʃædi,4
Mother,ræhuf ʃu ʒæblek ʃædi ʔel,4
Mother,ʃu ʒæblek ʃædi ʔel jom,4
Mother,wʃu hæj ʔili ʒuwæ ʔel,4
Mother,hæj ʔili ʒuwæ ʔel xubzæ,4
Mother,hæj ʃu ʔisimhæ jæ mama,4
Mother,ʃu hæj jæli læbisthæ tˤajjib,4
Mother,ʃætˤura ræhæf ʃu hædel lon,4
Mother,ræhuf jallah ʔiħki ʔel ʔælwæn,4
Mother,ʃætˤura ræhuf ʃu hæd jæ,4
Mother,ræhuf ʃu hæd jæ mama,4
Mother,bravo ʃu hæd hæd ʃu,4
Mother,ʃu hæd hæd ʃu ʔismo,4
Mother,ræhuf jallah ʔiħkili ʔæsmæʔ ʔel,4
Mother,jallah ʔiħkili ʔæsmæʔ ʔel fæwækeh,4
Mother,sˤaħa ja mama ruħti ʕind,4
Mother,ja mama ruħti ʕind mæjar,4
Mother,ræhuf ʃu hæd jæli bes,4
Mother,ʃu hæd jæli bes sæqif,4
Mother,wen biddek truħi ʔinti wʃædi,4
Mother,ræhuf ʔinti ʒiti ʕæ mama,4
Mother,ʔinti ʒiti ʕæ mama ʕælmustæʃfæ,4
Mother,ʃu kæn fi ʕæ ʔid,4
Mother,kæn fi ʕæ ʔid mama,4
Mother,ʃætˤura ræhuf jallah quli ʃætˤura,4
Mother,ræhuf jallah quli ʃætˤura ræhæf,4
Mother,ræhuf biʃu mama bitfærʃilek ʔæsnænek,4
Mother,ræhuf ʔeħki biddi ʔæruħ ʕælæs,4
Mother,ʔeħki biddi ʔæruħ ʕælæs suq,4
Mother,biddi teħkili ʕæn ʔæʃkæl ʔel,4
Mother,teħkili ʕæn ʔæʃkæl ʔel muwasalatˤ,4
Mother,ʕæn ʔæʃkæl ʔel muwasalatˤ ʃu,4
Mother,ʔæʃkæl ʔel muwasalatˤ ʃu hæd,4
Mother,sˤaħ hæd basˤ tˤajjib w,4
Mother,hæd basˤ tˤajjib w hæd,4
Mother,basˤ jæ mama hæd bærdˤo,4
Mother,whæd ʔel basˤ ʃu lono,4
Mother,bravo jallah ʔeħkili ʃu hæd,4
Mother,læʔ meʃ basˤ ʃu ʔisimhæ,4
Mother,ræhuf ʃu lon hæj ʔetˤ,4
Mother,lon hæj ʔetˤ tˤajjara ʃu,4
Mother,hæj ʔetˤ tˤajjara ʃu lon,4
Mother,ʔetˤ tˤajjara ʃu lon hæj,4
Mother,tˤajjara ʃu lon hæj ʔetˤ,4
Mother,tˤajjib ʃu hæd jæ mama,4
Mother,ræhæf ʔiħki menʃæn ʔaʕtˤiki ʃukælætæ,4
Mother,bel ʔæwæl ʔiħki bæʕdhæ bæqulek,4
Mother,ʔæwæl ʔiħki bæʕdhæ bæqulek wen,4
Mother,ʃu fi jæ mama ʕæʃænte,4
Mother,ruħti ʕind dar sido ʔel,4
Mother,ʕind dar sido ʔel jom,4
Mother,ʃatˤuræ tˤajjib ʃu ʔisim baba,4
Mother,wen biddek tħutˤi ʔel wæsæx,4
Mother,ræhuf fi ʃu silæ mitɣætˤje,4
Mother,bæʕræf jæ mama tˤajjib ʃu,4
Mother,jæ mama tˤajjib ʃu ʔismo,4
Mother,ræhuf ʃul wæħæd biħki læmmæ,4
Mother,ʃul wæħæd biħki læmmæ jokel,4
Mother,tˤajjib ʃu biħki ʔel ʔæðæn,4
Mother,biddek tħuti ʔel ʕinæb hon,4
Mother,læʔ kæmli ʔæw ʕiddi ʃatˤuræ,4
Mother,ʃu ʔisimhæ hæj hæj hæj,4
Mother,tˤajjib ʔiħkili ʔel ʔælwæn ʔili,4
Mother,ʔiħkili ʔel ʔælwæn ʔili btiʕræfihum,4
Mother,ʃatˤuræ jallah ʔiħki ræhæf ʃatˤuræ,4
Mother,ræhuf ʔiħki læ ʃuʃu baj,4
Mother,mælek jæ ræhæf ʃu fi,4
Mother,xalasˤ jæ mama bidhæʃ silæ,4
Mother,ræhuf ʃu hæd ʔel lon,4
Mother,wen biruħ baba kul jom,4
Mother,ʃu fi ʕælæ ʔesˤ sˤaħen,4
Mother,fi ʕælæ ʔesˤ sˤaħen wæsæx,4
Mother,ʔah ʔeʃ sˤar mæʕ jusef,4
Mother,ʔah sˤaħ ʕæ ʔido dæm,4
Mother,sˤaħ ʕæ ʔido dæm kif,4
Mother,ʕæ ʔido dæm kif biddæk,4
Mother,ʔido dæm kif biddæk tʃufhæ,4
Mother,ʔeʃ sˤar biʔiʒer jusef kif,4
Mother,sˤar biʔiʒer jusef kif wiʔeʕ,4
Mother,biʔiʒer jusef kif wiʔeʕ ʔah,4
Mother,jusef kif wiʔeʕ ʔah sˤaħiħ,4
Mother,kif wiʔeʕ ʔah sˤaħiħ ħatˤ,4
Mother,wiʔeʕ ʔah sˤaħiħ ħatˤ ʔidu,4
Mother,ʔah sˤaħiħ ħatˤ ʔidu hek,4
Mother,sˤaħiħ ħatˤ ʔidu hek foʔ,4
Mother,leʃ hu ʔeʃ kæn jeʕmæl,4
Mother,ʔah hek wiʔeʕ ʕælæ wiʒho,4
Mother,tˤajjeb ræjæn ʔintu ʃu ʔækæltu,4
Mother,ræjæn ʔintu ʃu ʔækæltu ʃu,4
Mother,ʔintu ʃu ʔækæltu ʃu tɣædetu,4
Mother,ʔækæltu ruz mmm ruz wʔeʃ,4
Mother,bidnæ nelʕæb luʕbæ jæ ræjæn,4
Mother,nelʕæb luʕbæ jæ ræjæn ʔæʃuf,4
Mother,luʕbæ jæ ræjæn ʔæʃuf ʔintæ,4
Mother,jæ ræjæn ʔæʃuf ʔintæ ʃatˤer,4
Mother,ræjæn ʔæʃuf ʔintæ ʃatˤer welæ,4
Mother,ʔæʃuf ʔintæ ʃatˤer welæ læʔ,4
Mother,ʔintæ ʃatˤer welæ læʔ bteʕræf,4
Mother,ʃatˤer welæ læʔ bteʕræf luʕbet,4
Mother,welæ læʔ bteʕræf luʕbet ʔel,4
Mother,læʔ bteʕræf luʕbet ʔel fæwæke,4
Mother,bteʕræf luʕbet ʔel fæwæke tˤajjib,4
Mother,luʕbet ʔel fæwæke tˤajjib ʔeʃ,4
Mother,ʔel fæwæke tˤajjib ʔeʃ hæj,4
Mother,tufæħæ ʃatˤer tˤajjib wʔeʃ hæj,4
Mother,tˤajjib nʃuf ʔiʃi tæni hæd,4
Mother,nʃuf ʔiʃi tæni hæd ʃu,4
Mother,ʔiʃi tæni hæd ʃu hæd,4
Mother,tæni hæd ʃu hæd ʔel,4
Mother,hæd ʃu hæd ʔel ʔasˤfar,4
Mother,mæʃi ʔeʃ hæd hæd lesˤɣir,4
Mother,ʔeʃ hæd hæd lesˤɣir lono,4
Mother,hæd hæd lesˤɣir lono ʔaxdˤar,4
Mother,ʕinæb ʃatˤer tˤajjib nʃuf ʔiʃi,4
Mother,tˤajjib nʃuf ʔiʃi tæni hæj,4
Mother,nʃuf ʔiʃi tæni hæj lekbiræ,4
Mother,ʔiʃi tæni hæj lekbiræ hæj,4
Mother,tæni hæj lekbiræ hæj batˤ,4
Mother,hæj lekbiræ hæj batˤ batˤ,4
Mother,wbitħebhæ ʔintæ ʔel batˤixæ zækje,4
Mother,ʔintæ ʔel batˤixæ zækje ʃatˤer,4
Mother,ʔel batˤixæ zækje ʃatˤer ʔintæ,4
Mother,batˤixæ zækje ʃatˤer ʔintæ sˤaħ,4
Mother,zækje ʃatˤer ʔintæ sˤaħ ʃu,4
Mother,ʃatˤer ʔintæ sˤaħ ʃu kæmæn,4
Mother,ʔeʃ hæj hæj binħutˤ fihæ,4
Mother,hæj hæj binħutˤ fihæ ʔel,4
Mother,hæj binħutˤ fihæ ʔel fæwæke,4
Mother,ʃu ʕmilnæ ʔel jom jæ,4
Mother,ʕmilnæ ʔel jom jæ ræjæn,4
Mother,kek ʔeʃ ħatˤenæ ʕælehæ bæsbuse,4
Mother,bæsbuse tˤajjib ʃu ħatˤenæ ʕælehæ,4
Mother,luz sˤaħ betħeb ʔel bæsbuse,4
Mother,sˤaħ betħeb ʔel bæsbuse ʔintæ,4
Mother,betħeb ʔel bæsbuse ʔintæ betħebhæ,4
Mother,ʔel bæsbuse ʔintæ betħebhæ ʔiħki,4
Mother,bæsbuse ʔintæ betħebhæ ʔiħki ʔah,4
Mother,tˤajjib ʃu kæmæn betħeb ʔækel,4
Mother,tˤajjib ʔeʃ kæmæn muʕæʒænæt ʔeʃ,4
Mother,hæj muʕæʒænæt hæj mu muʕæʒænæ,4
Mother,muʕæʒænæt hæj mu muʕæʒænæ fæwækeh,4
Mother,hæj mu muʕæʒænæ fæwækeh sˤaħ,4
Mother,mu muʕæʒænæ fæwækeh sˤaħ fæwækeh,4
Mother,muʕæʒænæ fæwækeh sˤaħ fæwækeh moz,4
Mother,fæwækeh sˤaħ fæwækeh moz tufæħ,4
Mother,burtuqal sˤaħ wʔeʃ kæmæn hæd,4
Mother,sˤaħ wʔeʃ kæmæn hæd ʃu,4
Mother,wʔeʃ kæmæn hæd ʃu ʔismu,4
Mother,ʃatˤer tˤajjib ʃu kæmæn bitħeb,4
Mother,tˤajjib ʃu kæmæn bitħeb ʔult,4
Mother,ʃu kæmæn bitħeb ʔult bitħeb,4
Mother,kæmæn bitħeb ʔult bitħeb tiʃræb,4
Mother,burtuqal læʔ ʔeʃ bitħeb tiʃræb,4
Mother,læʔ ʔeʃ bitħeb tiʃræb ʔesˤ,4
Mother,ʔeʃ bitħeb tiʃræb ʔesˤ sˤubuħ,4
Mother,tˤajjib ʔintæ tˤleʕt ʔel jom,4
Mother,ʔintæ tˤleʕt ʔel jom min,4
Mother,tˤleʕt ʔel jom min ʔel,4
Mother,ʔel jom min ʔel bet,4
Mother,kænæt ʔed dinjæ lel wilæ,4
Mother,ʔed dinjæ lel wilæ ʔeʃ,4
Mother,tˤajjib leh mæ xælitulu bæs,4
Mother,leh mæ xælitulu bæs jesħæ,4
Mother,mæ xælitulu bæs jesħæ bjækulhæ,4
Mother,xælitulu bæs jesħæ bjækulhæ kæn,4
Mother,bæs jesħæ bjækulhæ kæn næjem,4
Mother,bæs hæjo sˤiħi læw ʔestænet,4
Mother,hæjo sˤiħi læw ʔestænet kæn,4
Mother,sˤiħi læw ʔestænet kæn sˤiħi,4
Mother,læw ʔestænet kæn sˤiħi wʔækælhæ,4
Mother,ʔestænet kæn sˤiħi wʔækælhæ bæs,4
Mother,kæn sˤiħi wʔækælhæ bæs ʔintæ,4
Mother,sˤiħi wʔækælhæ bæs ʔintæ ʔækælthæ,4
Mother,wʔækælhæ bæs ʔintæ ʔækælthæ tæbʕætu,4
Mother,tˤajjib ʔintæ leh mæ ʔæʕtˤetni,4
Mother,beħreʔ ʕæʃæn ʔen næʕnæʕ beħreʔ,4
Mother,jæʕni ʔintæ ʕædi tækul beħreʔ,4
Mother,ʔintæ ʕædi tækul beħreʔ wʔænæ,4
Mother,ʕædi tækul beħreʔ wʔænæ læʔ,4
Mother,tækul beħreʔ wʔænæ læʔ ʔænæ,4
Mother,beħreʔ wʔænæ læʔ ʔænæ ʕædi,4
Mother,wʔænæ læʔ ʔænæ ʕædi ʔækul,4
Mother,læʔ ʔænæ ʕædi ʔækul beħreʔ,4
Mother,ʔænæ ʕædi ʔækul beħreʔ ʔintæ,4
Mother,ʕædi ʔækul beħreʔ ʔintæ betxæf,4
Mother,ʔækul beħreʔ ʔintæ betxæf ʔini,4
Mother,beħreʔ ʔintæ betxæf ʔini ʔækul,4
Mother,ʔintæ betxæf ʔini ʔækul beħreʔ,4
Mother,betxæf ʔini ʔækul beħreʔ biwæʒeʕ,4
Mother,ʃu ʕælli sˤotæk meʃ sæmeʕtæk,4
Mother,ʔilæ ʔænæ kunt biddi ʔæʒi,4
Mother,ʔænæ kunt biddi ʔæʒi mæʕækum,4
