Target_Child,nwæʔfo hon bæʒib kæmæn kursi,4
Target_Child,hon bæʒib kæmæn kursi bærʒæʕilkum,4
Target_Child,bæʒib kæmæn kursi bærʒæʕilkum ræħ,4
Target_Child,kæmæn kursi bærʒæʕilkum ræħ ʔæʒib,4
Target_Child,kursi bærʒæʕilkum ræħ ʔæʒib kursiten,4
Target_Child,mærħæbæ sˤaħbati hæjni ʔiʒit ræħ,4
Target_Child,sˤaħbati hæjni ʔiʒit ræħ ʔæħkilkum,4
Target_Child,hæjni ʔiʒit ræħ ʔæħkilkum kif,4
Target_Child,ʔiʒit ræħ ʔæħkilkum kif bniʕmæl,4
Target_Child,ræħ ʔæħkilkum kif bniʕmæl ʔel,4
Target_Child,ʔæħkilkum kif bniʕmæl ʔel fæsætin,4
Target_Child,kif bniʕmæl ʔel fæsætin hæj,4
Target_Child,bniʕmæl ʔel fæsætin hæj lbisthæ,4
Target_Child,ʔel fæsætin hæj lbisthæ hek,4
Target_Child,fæsætin hæj lbisthæ hek mama,4
Target_Child,ræħ ʔæfærʒikum ʔel modˤa ʔel,4
Target_Child,ʔæfærʒikum ʔel modˤa ʔel ʔæħlæ,4
Target_Child,ʔel modˤa ʔel ʔæħlæ tˤabʕæn,4
Target_Child,modˤa ʔel ʔæħlæ tˤabʕæn ʔænæ,4
Target_Child,ʔel ʔæħlæ tˤabʕæn ʔænæ mæ,4
Target_Child,ʔæħlæ tˤabʕæn ʔænæ mæ bidi,4
Target_Child,tˤabʕæn ʔænæ mæ bidi ʔærbutˤo,4
Target_Child,ʔænæ mæ bidi ʔærbutˤo menʃæn,4
Target_Child,mæ bidi ʔærbutˤo menʃæn mæ,4
Target_Child,bidi ʔærbutˤo menʃæn mæ jsˤirlo,4
Target_Child,ʔærbutˤo menʃæn mæ jsˤirlo ʔiʃi,4
Target_Child,hek tˤabʕæn tˤawil min fuʔ,4
Target_Child,tˤabʕæn tˤawil min fuʔ wtˤabʕæn,4
Target_Child,tˤawil min fuʔ wtˤabʕæn ʔistænu,4
Target_Child,min fuʔ wtˤabʕæn ʔistænu ʔæwæl,4
Target_Child,fuʔ wtˤabʕæn ʔistænu ʔæwæl ʔiʃi,4
Target_Child,wtˤabʕæn ʔistænu ʔæwæl ʔiʃi bæʕmæl,4
Target_Child,ʔistænu ʔæwæl ʔiʃi bæʕmæl hek,4
Target_Child,ʔæwæl ʔiʃi bæʕmæl hek menʃæn,4
Target_Child,ʔiʃi bæʕmæl hek menʃæn ʔæɣatˤi,4
Target_Child,bæʕmæl hek menʃæn ʔæɣatˤi wʔæʕmæl,4
Target_Child,hek menʃæn ʔæɣatˤi wʔæʕmæl ʔinu,4
Target_Child,menʃæn ʔæɣatˤi wʔæʕmæl ʔinu beʃæʔlub,4
Target_Child,ʔæɣatˤi wʔæʕmæl ʔinu beʃæʔlub læbisto,4
Target_Child,wʔæʕmæl ʔinu beʃæʔlub læbisto bæħutˤo,4
Target_Child,ʔinu beʃæʔlub læbisto bæħutˤo wbælifo,4
Target_Child,beʃæʔlub læbisto bæħutˤo wbælifo ħæwælæj,4
Target_Child,læbisto bæħutˤo wbælifo ħæwælæj wbæʕden,4
Target_Child,bæħutˤo wbælifo ħæwælæj wbæʕden bæħutˤo,4
Target_Child,wbælifo ħæwælæj wbæʕden bæħutˤo hek,4
Target_Child,ħæwælæj wbæʕden bæħutˤo hek ʔel,4
Target_Child,wbæʕden bæħutˤo hek ʔel jom,4
Target_Child,bæħutˤo hek ʔel jom ʕinæ,4
Target_Child,hek ʔel jom ʕinæ ʕurus,4
Target_Child,ʔel jom ʕinæ ʕurus badˤal,4
Target_Child,jom ʕinæ ʕurus badˤal læbisto,4
Target_Child,ʕinæ ʕurus badˤal læbisto hæjhum,4
Target_Child,ʕurus badˤal læbisto hæjhum wisˤlo,4
Target_Child,badˤal læbisto hæjhum wisˤlo læzem,4
Target_Child,læbisto hæjhum wisˤlo læzem ʔæħutˤ,4
Target_Child,hæjhum wisˤlo læzem ʔæħutˤ ʔel,4
Target_Child,wisˤlo læzem ʔæħutˤ ʔel meɪkʌp,4
Target_Child,læzem ʔæħutˤ ʔel meɪkʌp bæbæleʃ,4
Target_Child,ʔæħutˤ ʔel meɪkʌp bæbæleʃ hek,4
Target_Child,ʔel meɪkʌp bæbæleʃ hek ræsm,4
Target_Child,meɪkʌp bæbæleʃ hek ræsm ʔel,4
Target_Child,bæbæleʃ hek ræsm ʔel aɪlaɪnər,4
Target_Child,hek ræsm ʔel aɪlaɪnər sˤiʕeb,4
Target_Child,ræsm ʔel aɪlaɪnər sˤiʕeb whæjni,4
Target_Child,ʔel aɪlaɪnər sˤiʕeb whæjni mæʕækum,4
Target_Child,aɪlaɪnər sˤiʕeb whæjni mæʕækum txæfuʃ,4
Target_Child,sˤiʕeb whæjni mæʕækum txæfuʃ whælæʔ,4
Target_Child,whæjni mæʕækum txæfuʃ whælæʔ ræħ,4
Target_Child,mæʕækum txæfuʃ whælæʔ ræħ ʔæʔæneq,4
Target_Child,txæfuʃ whælæʔ ræħ ʔæʔæneq ħæli,4
Target_Child,whælæʔ ræħ ʔæʔæneq ħæli ben,4
Target_Child,ræħ ʔæʔæneq ħæli ben nædˤara,4
Target_Child,ʔæʔæneq ħæli ben nædˤara mama,4
Target_Child,ħæli ben nædˤara mama ħætˤet,4
Target_Child,ben nædˤara mama ħætˤet mekjæʒ,4
Target_Child,nædˤara mama ħætˤet mekjæʒ ʃufi,4
Target_Child,hæjni mæʕækum bæs ʃelt ʔen,4
Target_Child,mæʕækum bæs ʃelt ʔen nædˤara,4
Target_Child,bæs ʃelt ʔen nædˤara ʔænaqti,4
Target_Child,ʃelt ʔen nædˤara ʔænaqti ʔænaqæ,4
Target_Child,ʔen nædˤara ʔænaqti ʔænaqæ jallah,4
Target_Child,nædˤara ʔænaqti ʔænaqæ jallah bælæʃ,4
Target_Child,ʔænaqti ʔænaqæ jallah bælæʃ ʔel,4
Target_Child,ʔænaqæ jallah bælæʃ ʔel ʕærdˤ,4
Target_Child,jallah bælæʃ ʔel ʕærdˤ hælæʔ,4
Target_Child,bælæʃ ʔel ʕærdˤ hælæʔ ræħ,4
Target_Child,ʔel ʕærdˤ hælæʔ ræħ ʔæxud,4
Target_Child,ʕærdˤ hælæʔ ræħ ʔæxud selfie,4
Target_Child,hælæʔ ræħ ʔæxud selfie ræħ,4
Target_Child,ræħ ʔæxud selfie ræħ ʔæʕælemkum,4
Target_Child,ʔæxud selfie ræħ ʔæʕælemkum kif,4
Target_Child,selfie ræħ ʔæʕælemkum kif bæħutˤ,4
Target_Child,ræħ ʔæʕælemkum kif bæħutˤ ʔel,4
Target_Child,ʔæʕælemkum kif bæħutˤ ʔel mekjæʒ,4
Target_Child,kif bæħutˤ ʔel mekjæʒ ʔæbel,4
Target_Child,bæħutˤ ʔel mekjæʒ ʔæbel mæ,4
Target_Child,ʔel mekjæʒ ʔæbel mæ ʔæruħ,4
Target_Child,mekjæʒ ʔæbel mæ ʔæruħ ʔæshæl,4
Target_Child,ʔæbel mæ ʔæruħ ʔæshæl ʔiʃi,4
Target_Child,mæ ʔæruħ ʔæshæl ʔiʃi nbæleʃ,4
Target_Child,ʔæruħ ʔæshæl ʔiʃi nbæleʃ fe,4
Target_Child,ʔæshæl ʔiʃi nbæleʃ fe ʔel,4
Target_Child,ʔiʃi nbæleʃ fe ʔel miskæræ,4
Target_Child,nbæleʃ fe ʔel miskæræ wmæ,4
Target_Child,fe ʔel miskæræ wmæ betxærbeʃ,4
Target_Child,ʔel miskæræ wmæ betxærbeʃ ʔænæ,4
Target_Child,miskæræ wmæ betxærbeʃ ʔænæ bæʕref,4
Target_Child,wmæ betxærbeʃ ʔænæ bæʕref ʔæħutˤhæ,4
Target_Child,betxærbeʃ ʔænæ bæʕref ʔæħutˤhæ tˤabʕæn,4
Target_Child,ʔænæ bæʕref ʔæħutˤhæ tˤabʕæn whælæʔ,4
Target_Child,bæʕref ʔæħutˤhæ tˤabʕæn whælæʔ ræħ,4
Target_Child,ʔæħutˤhæ tˤabʕæn whælæʔ ræħ nħutˤ,4
Target_Child,tˤabʕæn whælæʔ ræħ nħutˤ ʔel,4
Target_Child,whælæʔ ræħ nħutˤ ʔel ħomræ,4
Target_Child,ræħ nħutˤ ʔel ħomræ bæs,4
Target_Child,nħutˤ ʔel ħomræ bæs ʔuwʕkum,4
Target_Child,ʔel ħomræ bæs ʔuwʕkum ʔetˤalʕu,4
Target_Child,ħomræ bæs ʔuwʕkum ʔetˤalʕu læbæræ,4
Target_Child,bæs ʔuwʕkum ʔetˤalʕu læbæræ tˤajjib,4
Target_Child,ʔuwʕkum ʔetˤalʕu læbæræ tˤajjib wʔizæ,4
Target_Child,ʔetˤalʕu læbæræ tˤajjib wʔizæ ħætˤetu,4
Target_Child,læbæræ tˤajjib wʔizæ ħætˤetu ʔel,4
Target_Child,tˤajjib wʔizæ ħætˤetu ʔel qinæʕ,4
Target_Child,wʔizæ ħætˤetu ʔel qinæʕ læl,4
Target_Child,ħætˤetu ʔel qinæʕ læl wiʒeh,4
Target_Child,ʔel qinæʕ læl wiʒeh wetħomærtu,4
Target_Child,qinæʕ læl wiʒeh wetħomærtu beʒhæz,4
Target_Child,læl wiʒeh wetħomærtu beʒhæz kul,4
Target_Child,wiʒeh wetħomærtu beʒhæz kul weʒihkum,4
Target_Child,wetħomærtu beʒhæz kul weʒihkum tˤajjib,4
Target_Child,beʒhæz kul weʒihkum tˤajjib hæjnæ,4
Target_Child,kul weʒihkum tˤajjib hæjnæ xalasˤnæ,4
Target_Child,weʒihkum tˤajjib hæjnæ xalasˤnæ ʔel,4
Target_Child,tˤajjib hæjnæ xalasˤnæ ʔel ħomræ,4
Target_Child,hæjnæ xalasˤnæ ʔel ħomræ wel,4
Target_Child,xalasˤnæ ʔel ħomræ wel miskæræ,4
Target_Child,ʔel ħomræ wel miskæræ whælæʔ,4
Target_Child,ħomræ wel miskæræ whælæʔ ʔel,4
Target_Child,wel miskæræ whælæʔ ʔel kuħul,4
Target_Child,miskæræ whælæʔ ʔel kuħul wbteθbætu,4
Target_Child,whælæʔ ʔel kuħul wbteθbætu mniħ,4
Target_Child,ʔel kuħul wbteθbætu mniħ mniħ,4
Target_Child,kənsilər nsit hæd bixæli ʔes,4
Target_Child,nsit hæd bixæli ʔes sæwæd,4
Target_Child,hæd bixæli ʔes sæwæd jruħ,4
Target_Child,bixæli ʔes sæwæd jruħ tˤajjib,4
Target_Child,ʔes sæwæd jruħ tˤajjib hæjni,4
Target_Child,sæwæd jruħ tˤajjib hæjni mæʕækum,4
Target_Child,jruħ tˤajjib hæjni mæʕækum ʔænæ,4
Target_Child,tˤajjib hæjni mæʕækum ʔænæ mbæreħ,4
Target_Child,hæjni mæʕækum ʔænæ mbæreħ læmmæ,4
Target_Child,mæʕækum ʔænæ mbæreħ læmmæ ruħt,4
Target_Child,ʔænæ mbæreħ læmmæ ruħt ʕæl,4
Target_Child,mbæreħ læmmæ ruħt ʕæl ʕurus,4
Target_Child,læmmæ ruħt ʕæl ʕurus mæ,4
Target_Child,ruħt ʕæl ʕurus mæ ħætˤet,4
Target_Child,ʕæl ʕurus mæ ħætˤet mekjæʒ,4
Target_Child,ʕurus mæ ħætˤet mekjæʒ ʔimi,4
Target_Child,mæ ħætˤet mekjæʒ ʔimi mænkærætni,4
Target_Child,ħætˤet mekjæʒ ʔimi mænkærætni wlisæto,4
Target_Child,mekjæʒ ʔimi mænkærætni wlisæto meʃ,4
Target_Child,ʔimi mænkærætni wlisæto meʃ ræjeħ,4
Target_Child,mænkærætni wlisæto meʃ ræjeħ mama,4
Target_Child,wlisæto meʃ ræjeħ mama hædæ,4
Target_Child,meʃ ræjeħ mama hædæ foʔ,4
Target_Child,ræjeħ mama hædæ foʔ wilæ,4
Target_Child,mama hædæ foʔ wilæ tæħet,4
Target_Child,mama hæj foʔ wilæ tæħet,4
Target_Child,mama ʔel ʔiʃi ʔel wæħid,4
Target_Child,ʔel ʔiʃi ʔel wæħid jæli,4
Target_Child,ʔiʃi ʔel wæħid jæli ʒuwæ,4
Target_Child,ʔel wæħid jæli ʒuwæ ʔismæʕu,4
Target_Child,wæħid jæli ʒuwæ ʔismæʕu xælikum,4
Target_Child,jæli ʒuwæ ʔismæʕu xælikum ʕæl,4
Target_Child,ʒuwæ ʔismæʕu xælikum ʕæl vɪdioʊ,4
Target_Child,ʔismæʕu xælikum ʕæl vɪdioʊ ræħ,4
Target_Child,xælikum ʕæl vɪdioʊ ræħ ʔæɣæssel,4
Target_Child,ʕæl vɪdioʊ ræħ ʔæɣæssel wiʒhi,4
Target_Child,vɪdioʊ ræħ ʔæɣæssel wiʒhi mniħ,4
Target_Child,ræħ ʔæɣæssel wiʒhi mniħ mniħ,4
Target_Child,ʔæɣæssel wiʒhi mniħ mniħ wʔærʒæʕ,4
Target_Child,weno weno weno jæ jæ,4
Target_Child,weno weno jæ jæ hajju,4
Target_Child,weno jæ jæ hajju hajju,4
Target_Child,sˤabæħ ʔel xer jæ wærdæ,4
Target_Child,wæħæd ʔiθnen tælætæ ʔærbæʕæ xæmsæ,4
Target_Child,ʔiθnen tælætæ ʔærbæʕæ xæmsæ sittæ,4
Target_Child,tælætæ ʔærbæʕæ xæmsæ sittæ sæbʕæ,4
Target_Child,ʔærbæʕæ xæmsæ sittæ sæbʕæ tæmæni,4
Target_Child,xæmsæ sittæ sæbʕæ tæmæni tisʕæ,4
Target_Child,sittæ sæbʕæ tæmæni tisʕæ ʕæʃæræ,4
Target_Child,weno ʔez weno ʔez zæhri,4
Target_Child,weno weno hæjjo hæjjo ʔæzraq,4
Target_Child,ʔoh wæw hæj læ silæ,4
Target_Child,læ mama hæj læ silæ,4
Target_Child,lædˤuħæ wæħæd tinen tælætæ ʔærbæʕæ,4
Target_Child,wæħæd tinen tælætæ ʔærbæʕæ wʌn,4
Target_Child,tinen tælætæ ʔærbæʕæ wʌn tu,4
Target_Child,tælætæ ʔærbæʕæ wʌn tu θri,4
Target_Child,ʔærbæʕæ wʌn tu θri fɔr,4
Target_Child,læʔ ʔili læ ræhæf wæħæd,4
Target_Child,ʔili læ ræhæf wæħæd tinen,4
Target_Child,læ ræhæf wæħæd tinen tælætæ,4
Target_Child,ræhæf wæħæd tinen tælætæ ʔærbæʕæ,4
Target_Child,hæd læ silæ whæd læ,4
Target_Child,læ silæ whæd læ ræhæf,4
Target_Child,mama ʒæbæt bebi ħiliw wisˤɣir,4
Target_Child,ħsˤan æħæd tinen tælætæ ʔærbæʕæ,4
Target_Child,læʔ ʃædi mama bitqul ræhæf,4
Target_Child,ʃædi mama bitqul ræhæf hæblæ,4
Target_Child,wæħæd nin tælætæ ʔæbæ xæmsæ,4
Target_Child,nin tælætæ ʔæbæ xæmsæ sitæ,4
Target_Child,tælætæ ʔæbæ xæmsæ sitæ sæbʔa,4
Target_Child,ʔæbæ xæmsæ sitæ sæbʔa tæmæne,4
Target_Child,xæmsæ sitæ sæbʔa tæmæne tisʔæ,4
Target_Child,sitæ sæbʔa tæmæne tisʔæ ʔæsælæ,4
Target_Child,hon bæs ræħæt ʔel wawa,4
Target_Child,θri fɔr faɪv sɪks xalasˤ,4
Target_Child,ʔasˤfar ʔæswæd ʔæzraq ʔæħmær zæhri,4
Target_Child,ʔah sˤaħ batˤixæ tinten whæj,4
Target_Child,sˤaħ batˤixæ tinten whæj ʔeʃ,4
Target_Child,bæs ʔinti tetæ neʕmæ wmæħmud,4
Target_Child,ʔah bæs ʔel kæmmæmæ sido,4
Target_Child,bæs ʔel kæmmæmæ sido ħilu,4
Target_Child,baba wælæd qajs mħæmmæd wælæd,4
Target_Child,bæs ʔili bænæt tetæ neʕmæ,4
Target_Child,ʔænæ ħæbæsto wbel bet dˤælo,4
Target_Child,ʔah ʔænæ ʔætˤlaʕ bærræ læʔi,4
Target_Child,ʔah ʔækælet neskæfe ʔah hek,4
Target_Child,ʔækælet neskæfe ʔah hek bæʕden,4
Target_Child,neskæfe ʔah hek bæʕden ʔænwæʕ,4
Target_Child,ʔah hek bæʕden ʔænwæʕ kulo,4
Target_Child,ʔækælnæ fihum ʔel ʔækel ʒæʒ,4
Target_Child,sˤɣir ʔah læʔ meʃ bæħær,4
Target_Child,ʔah læʔ meʃ bæħær kbir,4
Target_Child,tufæħ ʔah jæʕni ʔæxdˤar ʔæħmar,4
Target_Child,ʔaj ʔaj jæsnæni jæ jæ,4
Target_Child,ʔaj jæsnæni jæ jæ jæ,4
Target_Child,jæsnæni jæ jæ jæ mama,4
Target_Child,meʃ qabl ʃwæj ħdirnæ ʕæt,4
Target_Child,qabl ʃwæj ħdirnæ ʕæt telfizion,4
Target_Child,ʃwæj ħdirnæ ʕæt telfizion hæssæ,4
Target_Child,ħdirnæ ʕæt telfizion hæssæ wæqt,4
Target_Child,ʕæt telfizion hæssæ wæqt ʔen,4
Target_Child,telfizion hæssæ wæqt ʔen nom,4
Target_Child,hæssæ wæqt ʔen nom jæ,4
Target_Child,wæqt ʔen nom jæ mæmæ,4
Target_Child,læ min ʔel bubijæ læ,4
Target_Child,min ʔel bubijæ læ særæ,4
Target_Child,zæʔfulhæ læ særæ mæ ʔæʃtˤarhæ,4
Target_Child,læ særæ mæ ʔæʃtˤarhæ ʃatˤuræ,4
Target_Child,særæ mæ ʔæʃtˤarhæ ʃatˤuræ tˤajjib,4
Target_Child,mæ ʔæʃtˤarhæ ʃatˤuræ tˤajjib hælæʔ,4
Target_Child,bæs mama ʕæsijaræ ʔænæ ʔæruħ,4
Target_Child,mama ʕæsijaræ ʔænæ ʔæruħ ʕæsæjaræ,4
Target_Child,ʔah mama bæs fæzæt ʕæsijaræ,4
Target_Child,ʔah ʔiħnæ ʒibnæhæ biɣurfet ʔetilfizjon,4
Target_Child,ʔah bæʕden dˤæwinæhæ bet tilfizjon,4
Target_Child,bæʕden humæ xallasˤu whumæ tˤilʕu,4
Target_Child,bæʕden ruħæ bærræ ʔel jom,4
Target_Child,baba biʔul wædini ʕæ dar,4
Target_Child,biʔul wædini ʕæ dar sido,4
Target_Child,wædini ʕæ dar sido whu,4
Target_Child,ʕæ dar sido whu tæʕbæn,4
Target_Child,dar sido whu tæʕbæn ʔah,4
Target_Child,sido whu tæʕbæn ʔah ʕæ,4
Target_Child,whu tæʕbæn ʔah ʕæ bæʕden,4
Target_Child,ʔah læʔ baba ʔæl ruħ,4
Target_Child,læʔ baba ʔæl ruħ ʕæ,4
Target_Child,baba ʔæl ruħ ʕæ ħædiqa,4
Target_Child,ʔæl ruħ ʕæ ħædiqa tæʕbæn,4
Target_Child,kul jom ʔedˤ duhur hek,4
Target_Child,bæs ktir læsido mæħmud sido,4
Target_Child,ktir læsido mæħmud sido bæder,4
Target_Child,laeʔʔ ʔaenae ʕaendi koora kibiirae,4
Target_Child,laeʔʔae ʔil ʕaendi ʔil fel,4
Target_Child,ʔil ʕaendi ʔil fel ʔil,4
Target_Child,ʕaendi ʔil fel ʔil ʔelkoora,4
Target_Child,ʔil fel ʔil ʔelkoora ʔil,4
Target_Child,fel ʔil ʔelkoora ʔil fel,4
Target_Child,ʔil ʔelkoora ʔil fel ʔil,4
Target_Child,ʔelkoora ʔil fel ʔil beliʕaeb,4
Target_Child,ʔil fel ʔil beliʕaeb baeʃootˤ,4
Target_Child,fel ʔil beliʕaeb baeʃootˤ ʔil,4
Target_Child,ʔil beliʕaeb baeʃootˤ ʔil felkoora,4
Target_Child,beliʕaeb baeʃootˤ ʔil felkoora we,4
Target_Child,baeʃootˤ ʔil felkoora we baess,4
Target_Child,ʔuh ʔaenae ʕaendi ʕarabijja baesooʔ,4
Target_Child,ʔaenae ʕaendi ʕarabijja baesooʔ biihae,4
Target_Child,ʕaendi ʕarabijja baesooʔ biihae ʔitkasˤarit,4
Target_Child,laeʔʔ ʔaenae ʕaendi ʕarabijja ʔaenae,4
Target_Child,ʔaenae ʕaendi ʕarabijja ʔaenae ʕaendi,4
Target_Child,ʕaendi ʕarabijja ʔaenae ʕaendi ʔaenae,4
Target_Child,ʕarabijja ʔaenae ʕaendi ʔaenae ʕaendi,4
Target_Child,ʔaenae ʕaendi ʔaenae ʕaendi sˤoora,4
Target_Child,ʕaendi ʔaenae ʕaendi sˤoora felbeet,4
Target_Child,we ʃooft ʔelʔerd bijaeaekul sodaeaeni,4
Target_Child,dae ʔitneen ʔil huwwae bijeʕmel,4
Target_Child,ʔitneen ʔil huwwae bijeʕmel kedae,4
Target_Child,ʔerraaɡel dae ʔil laeaebesu dae,4
Target_Child,dae ʔil laeaebesu dae kedae,4
Target_Child,ʔil laeaebesu dae kedae bijeʕmel,4
Target_Child,laeaebesu dae kedae bijeʕmel be,4
Target_Child,dae kedae bijeʕmel be ʔiidu,4
Target_Child,kedae bijeʕmel be ʔiidu kedae,4
Target_Child,maeʕaeaeh ʕaemo Magdy ɡaeh ʃaeaef,4
Target_Child,ʕaemo Magdy ɡaeh ʃaeaef ʔelʔaesaed,4
Target_Child,koora di we di we,4
Target_Child,we di we di koora,4
Target_Child,huwwae laeaebes masˤk we bijeʕmel,4
Target_Child,ʔaenae ћaeʕmel bebbi we ɡaeaej,4
Target_Child,laeʔʔ dae ʔil tˤaaleʕ ʕaessellem,4
Target_Child,ћaejesiib ʔil ʔelћaebl bitaeaeʕu we,4
Target_Child,ʔil ʔelћaebl bitaeaeʕu we jiiɡi,4
Target_Child,ʔelћaebl bitaeaeʕu we jiiɡi jaeaekulni,4
Target_Child,we tˤalaʕet foʔʔ ʔesˤsˤatˤћ ʕaeʃaeaen,4
Target_Child,tˤalaʕet foʔʔ ʔesˤsˤatˤћ ʕaeʃaeaen jaeaekulni,4
Target_Child,laeʔʔae ʔil aa ʔil huwwae,4
Target_Child,ʔil aa ʔil huwwae ʔetˤtˤajjaara,4
Target_Child,aa ʔil huwwae ʔetˤtˤajjaara raaћa,4
Target_Child,ʔil huwwae ʔetˤtˤajjaara raaћa ʕaelmatˤaar,4
Target_Child,waeʔʕ ʔil ʔetˤtˤajjaara bitaeaeʕtu ʔitkasˤsˤarit,4
Target_Child,ʔelwaelaed bijeftaeћ ʔeeh ʕaeʃaeaen ʔeeh,4
Target_Child,bijeftaeћ ʔeeh ʕaeʃaeaen ʔeeh bijeftaeћ,4
Target_Child,ʔeeh ʕaeʃaeaen ʔeeh bijeftaeћ ʔelbaeaeb,4
Target_Child,ʕaeʃaeaen ʔeeh bijeftaeћ ʔelbaeaeb ʕaeʃaeaen,4
Target_Child,ʔeeh bijeftaeћ ʔelbaeaeb ʕaeʃaeaen barra,4
Target_Child,bijeftaeћ ʔelbaeaeb ʕaeʃaeaen barra ʕaeʃaeaen,4
Target_Child,ʔelbaeaeb ʕaeʃaeaen barra ʕaeʃaeaen ʔeeh,4
Target_Child,laeʔʔ dae ʔil foʔʔ ʔeeh,4
Target_Child,laeʔʔae dae ʔil laeaebesu ʔeeh,4
Target_Child,dae ʔil laeaebesu ʔeeh dae,4
Target_Child,laeʔʔ baeʔuulek ʔil ʔaeaeʕdae felbaћr,4
Target_Child,ʕaewwaeaemae ʔil ʔaenae baerkaebhae felbaћr,4
Target_Child,ʔil ʔelbaћr bijiiɡi we jimaeʃini,4
Target_Child,ʔelbaћr bijiiɡi we jimaeʃini baruuћ,4
Target_Child,bijiiɡi we jimaeʃini baruuћ we,4
Target_Child,we jimaeʃini baruuћ we jimaeʃini,4
Target_Child,jimaeʃini baruuћ we jimaeʃini barooћ,4
Target_Child,baruuћ we jimaeʃini barooћ we,4
Target_Child,we jimaeʃini barooћ we jimaeʃini,4
Target_Child,jimaeʃini barooћ we jimaeʃini baruuћ,4
Target_Child,barooћ we jimaeʃini baruuћ hinaeaek,4
Target_Child,ʔelboobi aa tˤaaleʕ maeʃae feʃʃaeaerʕ,4
Target_Child,laeʔʔ ћaeʔuul di ћaeʔuul ʔil,4
Target_Child,ћaeʔuul di ћaeʔuul ʔil henae,4
Target_Child,melʔaewwel dae ʔeeh dae baeʔae,4
Target_Child,dae ћaejedˤrab ʔelbet dool ћaejedˤrabu,4
Target_Child,ћaejedˤrab ʔelbet dool ћaejedˤrabu dool,4
Target_Child,ʔelbet dool ћaejedˤrabu dool ћaejedˤrabu,4
Target_Child,dool ћaejedˤrabu dool ћaejedˤrabu ʔelbet,4
Target_Child,dae taeʕlaeb bijbosˤsˤ ʕaelae di,4
Target_Child,dae ʔeeh dae ʔeeh dae,4
Target_Child,dae we dae ɡaezmae we,4
Target_Child,we dae ɡaezmae we dae,4
Target_Child,dae ʔeeh dae ʔil foʔʔ,4
Target_Child,faerxae we dae ʔeeh dae,4
Target_Child,ʔeeh we dae ʔeeh dae,4
Target_Child,we dae ʔil ʔeeh dae,4
Target_Child,dae ʔil ʔeeh dae kaemaeaen,4
Target_Child,bijeʕmel bijnaezzel taeћt ʔezzaelluumae bitaeaeʕtu,4
Target_Child,miin ʔil ʔesˤsˤorsˤaar ʔil maeaeʃi,4
Target_Child,ʔeeh dae kaemaeaen dae ʔeeh,4
Target_Child,dae ʔelfiil we dae ʔelfiil,4
Target_Child,ʔelfiil we dae ʔelfiil ʔaebuzaelluumae,4
Target_Child,dae ʔeeh dae ʔil ɡowwae,4
Target_Child,ʔil ʔil ʔettaeʕlaeb ʔelkibiir ʕaeʃaeaen,4
Target_Child,ʔil ʔettaeʕlaeb ʔelkibiir ʕaeʃaeaen jexaewwef,4
Target_Child,ʔiʃtaeritli min ʕaend ʔerraaɡel ʔil,4
Target_Child,min ʕaend ʔerraaɡel ʔil huwwae,4
Target_Child,ʕaend ʔerraaɡel ʔil huwwae ʔil,4
Target_Child,tirooћ hinaeaek ʕaeʃaeaen bitoʕood ɡaembi,4
Target_Child,ɡaemb ʔeltaeaeni ʔil zaejj dae,4
Target_Child,ɡiibili ʔil hinaeaek ʔil zaejj,4
Target_Child,ʔil hinaeaek ʔil zaejj dae,4
Target_Child,bineћotˤtˤ bitiћotˤtˤ ʔil ʔelmobaajel bitaeaeʕik,4
Target_Child,tˤab bosˤsˤ Abderrahman taeʕaeaelae henae,4
Target_Child,binoʕood ʕaeleh maebineʕmeluʃ bi ћaeaeɡae,4
Target_Child,laeʔʔ ʔelʔutˤtˤa tˤalaʕit wel taeffit,4
Target_Child,ʔelʔutˤtˤa tˤalaʕit wel taeffit majja,4
Target_Child,we di dae we dae,4
Target_Child,di dae we dae we,4
Target_Child,we dae we dae ʔeeh,4
Target_Child,ʔeeh we dae ʔeeh we,4
Target_Child,laeʔʔ laeaebes tˤaʔijja we ʔeeh,4
Target_Child,laeaebes tˤaʔijja we ʔeeh taeaeni,4
Target_Child,laeʔʔ laemmae ʔaenaeaedi ʕaeleeki ʔaeʔuulek,4
Target_Child,laemmae ʔaenaeaedi ʕaeleeki ʔaeʔuulek Basmal,4
Target_Child,ʔaenaeaedi ʕaeleeki ʔaeʔuulek Basmal teʔuulili,4
Target_Child,ʕaeleeki ʔaeʔuulek Basmal teʔuulili ʔeeh,4
Target_Child,ha ha ʔaenae ʕaeaejzae dae,4
Target_Child,ʔaeʕod henae ʕaeaejzae ʔaeʕod henae,4
Target_Child,ʔah raasˤi rooʒ henae ʔaeʕood,4
Target_Child,raasˤi rooʒ henae ʔaeʕood henae,4
Target_Child,ʕaemo dae henae ʕaemo tˤaaleʕ,4
Target_Child,dae henae ʕaemo tˤaaleʕ henae,4
Target_Child,bent we bent we bent,4
Target_Child,di toortˤa we di toortˤa,4
Target_Child,bijsooʔu di di wara di,4
Target_Child,di di wara di ɡaembaehae,4
Target_Child,di wara di ɡaembaehae we,4
Target_Child,wara di ɡaembaehae we di,4
Target_Child,di ɡaembaehae we di bitisooʔ,4
Target_Child,ɡaembaehae we di bitisooʔ ʔelʕarabijja,4
Target_Child,di bijaeaexod bent jewaeddihae ʔennaar,4
Target_Child,laeʔʔ di kooko laeʔʔ di,4
Target_Child,di kooko laeʔʔ di batˤtˤa,4
Target_Child,neftaeћu we nedxool neʔfel ʔelbaeaeb,4
Target_Child,we nedxool neʔfel ʔelbaeaeb waraana,4
Target_Child,biʕiid ʔezˤzˤaraafa ɡaeraet we taeaekul,4
Target_Child,ʔezˤzˤaraafa ɡaeraet we taeaekul ʕaesaelijjae,4
Target_Child,ʔaekaelt ɡazˤaraja taeaenjae di kullaehae,4
Target_Child,ɡazˤaraja taeaenjae di kullaehae we,4
Target_Child,taeaenjae di kullaehae we xijaara,4
Target_Child,waeʔfae ɡaemb ʃaɡara ʕaeʃaeaen ʔeʃʃaɡara,4
Target_Child,ɡaemb ʃaɡara ʕaeʃaeaen ʔeʃʃaɡara toʔaʕ,4
Target_Child,ʃaɡara ʕaeʃaeaen ʔeʃʃaɡara toʔaʕ ʕaeleehae,4
Target_Child,we dae we dae raaɡel,4
Target_Child,dae we dae raaɡel ʔelkoora,4
Target_Child,we dae we dae xoloosˤ,4
Target_Child,dae we dae xoloosˤ we,4
Target_Child,we dae xoloosˤ we dae,4
Target_Child,dae xoloosˤ we dae xoloosˤ,4
Target_Child,naeaexod dae noʕod ʕaelae dool,4
Target_Child,bijemsek ʔeʃʃaɡara we bijoʔaʕ ʕaeleehae,4
Target_Child,ʔaenae laebaesu ʕaeʃaeaen huwwae ɡidiid,4
Target_Child,bilʕaeb baeftaeћ ʔeʃʃebaeaek bijfelu we,4
Target_Child,baeftaeћ ʔeʃʃebaeaek bijfelu we rooћ,4
Target_Child,ʔeʃʃebaeaek bijfelu we rooћ we,4
Target_Child,bijfelu we rooћ we ћaerooћ,4
Target_Child,we rooћ we ћaerooћ baerkaeb,4
Target_Child,rooћ we ћaerooћ baerkaeb ʔelmorɡeeћae,4
Target_Child,raaћlna Motaz raaћ ʕaend mamtu,4
Target_Child,laeʔʔ di weћʃae dae weћʃ,4
Target_Child,mmm ʔenti baeʔae xaelliiki biʕiid,4
Target_Child,ʔaeʔuul mama zaemaenhaeɡaejjae we ʔenti,4
Target_Child,mama zaemaenhaeɡaejjae we ʔenti xaelliki,4
Target_Child,zaemaenhaeɡaejjae we ʔenti xaelliki biʕiid,4
Target_Child,bosˤsˤi bosˤsˤi henae ʔenti ћaetexdi,4
Target_Child,bosˤsˤi henae ʔenti ћaetexdi Ahmed,4
Target_Child,jalla di ʔenti bitiɣaenni bi,4
Target_Child,di ʔenti bitiɣaenni bi di,4
Target_Child,mama zaemaenhaeɡaejjae ɡaejjae xalaasˤ xoloosˤ,4
Target_Child,mama zaemaenhaeɡaejjae ɡaejjae beʕd ʃiwaejjae,4
Target_Child,ћaeʔuul xaems daeʔaeaejeʔ xaems daeʔaeaejeʔ,4
Target_Child,xaems daeʔaeaejeʔ xaems daeʔaeaejeʔ xaems,4
Target_Child,daeʔaeaejeʔ xaems daeʔaeaejeʔ xaems daeʔaeaejeʔ,4
Target_Child,xaems daeʔaeaejeʔ xaems daeʔaeaejeʔ jae,4
Target_Child,daeʔaeaejeʔ xaems daeʔaeaejeʔ jae ɡaemiil,4
Target_Child,xaems daeʔaeaejeʔ jae ɡaemiil fettoortˤa,4
Target_Child,raaɡel tˤalaʕ ʕaeʃaeaen koorsi ɡidiid,4
Target_Child,bijʔuul haeww we dae bijʔuul,4
Target_Child,haeww we dae bijʔuul waʕʕ,4
Target_Child,ʔaenae ћaelbeshae ʔennadˤdˤaara aa di,4
Target_Child,kedae baeʃoof kedae meʃ ћaeʃoof,4
Target_Child,ʔaenae siibini ʔaelbes ʔennadˤdˤaara di,4
Target_Child,bosˤsˤi jalla netzaeћlaeʔ bi dae,4
Target_Child,min fadˤllek ʕaeaejez ʔaelʕaeb belbaelloonae,4
Target_Child,fadˤllek ʕaeaejez ʔaelʕaeb belbaelloonae di,4
Target_Child,biteʕmel ʔeeh bitedˤrab lel Omar,4
Target_Child,felmosiiqa felmosiiqa ʔil hinaeaek miis,4
Target_Child,felmosiiqa ʔil hinaeaek miis tezʕael,4
Target_Child,ʔil hinaeaek miis tezʕael minnae,4
Target_Child,ʔaeɡiib ʔelʔaelaem ʕaeʃaeaen ʔaelaewwen biih,4
Target_Child,bijʔaellaeʕu ʔeʃʃaraab we kootʃi we,4
Target_Child,ʔeʃʃaraab we kootʃi we jedˤrabu,4
Target_Child,aa bijeftaeћ ʔelʕarabijja meʃ raadˤi,4
Target_Child,bijeftaeћ ʔelʕarabijja meʃ raadˤi jedxool,4
Target_Child,ʔeћnae neћki di ћaewaerrilek ћaeaeɡae,4
Target_Child,ʔerraaɡel maesaek batˤnu natˤtˤet foʔʔu,4
Target_Child,kaeaenit bitiʔuullek baeʕmel sˤelsˤaal bissilselae,4
Target_Child,we ʕaemel kaemaeaen mmm ħaekae,4
Target_Child,ʕaemel kaemaeaen mmm ħaekae ʔelqesˤsˤa,4
Target_Child,kont baeʕmel kont naezlae ʕaend,4
Target_Child,baeʕmel kont naezlae ʕaend mamti,4
Target_Child,kont naezlae ʕaend mamti we,4
Target_Child,naezlae ʕaend mamti we ɡeet,4
Target_Child,ʕaend mamti we ɡeet felħadˤaana,4
Target_Child,ʔeʕmel sˤelsˤaal beltˤarabezˤa baess baess,4
Target_Child,sˤelsˤaal beltˤarabezˤa baess baess ʔaeћotˤtˤ,4
